Title,Year,Duration,MPA,Rating,Votes,méta_score,description,Movie Link,writers,director,budget
266. Mermaids of Tiburon,1962,1h 16m,Unrated,5.3,206,,A diver is aided in his search for sunken treasure by beautiful mermaids.,https://www.imdb.com/title/tt0056233/?ref_=sr_i_266,,,
267. The Carpet of Horror,1962,1h 25m,Not Rated,5.3,391,,An evil genius uses poison gas to avenge himself on his enemies.,https://www.imdb.com/title/tt0056567/?ref_=sr_i_267,,,
268. Nature's Playmates,1962,1h 2m,Unrated,5.3,112,,"Chicago private detective Russell Harper and his assistant, Diana, travel to a Florida nudist camp to find a missing husband and both of them soon become embroided with the life of nudists while falling in love with each other.",https://www.imdb.com/title/tt0056273/?ref_=sr_i_268,,,
269. Anno 79: La distruzione di Ercolano,1962,1h 53m,Not Rated,4.5,147,,Intrigue at the Roman Emperor's court prior to its destruction by Vesuvius.,https://www.imdb.com/title/tt0055754/?ref_=sr_i_269,,,
270. The Tale of Zatoichi Continues,1962,1h 12m,Not Rated,7.2,2.9K,,"The blind masseur and swordsman, Zatoichi, learns of a powerful political figure's secret and is quickly tailed by a group of killers.",https://www.imdb.com/title/tt0200309/?ref_=sr_i_270,,,
271. Forever My Love,1962,2h 27m,,6.7,248,,"The romantic ""Sissi"" trilogy condensed into one film. Emperor Franz Joseph of Austria falls in love with young princess Elisabeth.",https://www.imdb.com/title/tt0055994/?ref_=sr_i_271,,,
272. Confessions of an Opium Eater,1962,1h 25m,Not Rated,6.2,808,,"In 19th-century San Francisco's Chinatown, American adventurer Gilbert De Quincey saves slave girls owned by the Chinese Tong factions.",https://www.imdb.com/title/tt0055864/?ref_=sr_i_272,,,
273. Los forajidos,1962,1h 23m,,5.5,11,,,https://www.imdb.com/title/tt0279821/?ref_=sr_i_273,,,
274. Varan the Unbelievable,1962,1h 10m,Unrated,4.5,874,,Heavily alerted American version of Japan's Varan. A prehistoric behemoth is unwittingly awoken from hibernation due to a U.S-Japanese military experiment for economic means on it's watery lair.,https://www.imdb.com/title/tt0056648/?ref_=sr_i_274,,,
275. El filibusterismo,1962,1h 57m,TV-PG,8.0,31,,"Juan Crisostomo Ibarra has changed his name and identity to rich jeweler Simoun. In disguise, he travels the world amassing wealth, which he intends to use to topple the corrupt and abusive regime in his native land. But Simoun's real motive is personal. He wants to rescue his beloved, Maria Clara, from the convent and avenge the death of his father. In a forest on Christmas Eve, medical student Basilio recognizes Simoun as the man who helped bury his mother Sisa under a tree over 10 years ago. Simoun is in the forest to retrieve the gems he buried near Sisa's grave. As the film progresses, all the secrets and intrigues are revealed, and the plotters' plan fails. A good Filipino priest throws Simoun's jewels away, thereby eliminating the greed, violence, and other evils they might have provoked.",https://www.imdb.com/title/tt0354579/?ref_=sr_i_275,,,
276. Sweet Violence,1962,1h 16m,Not Rated,4.6,218,,"Olivier, a handsome but callow and moody young student, picks up an enthusiastic actress during a theatre rehearsal, and is introduced to her acquaintances -- a group of jaded rich kids who spend their time storming around the Riviera harassing passersby, throwing wild parties and following all the latest trends. When sexy Elke gives him the eye, he leaves the actress in the lurch and joins the gang for a decadent party aboard a yacht. However, Elke's wanton ways and Olivier's inexperience do not mesh. Charlie accidentally sets the yacht afire. The gang wreaks its vengeance by luring him into a dangerous contest of bravura on a construction site.",https://www.imdb.com/title/tt0055926/?ref_=sr_i_276,,,
277. Anpadh,1962,2h 30m,,6.8,136,,"A wealthy, pampered and illiterate woman faces many challenges after her marriage.",https://www.imdb.com/title/tt0206554/?ref_=sr_i_277,,,
278. Kozara,1962,2h 4m,,7.2,816,,The struggle of the Yugoslav partisans against the Germans.,https://www.imdb.com/title/tt0055059/?ref_=sr_i_278,,,
279. Az aranyember,1962,1h 47m,,6.8,644,,"Michael Tímar, captain of the St. Barbara, marries the daughter of a Turkish aristocrat on the run. While skilfully managing his wife fortune, Tímar is torn between the demands of bourgeois civilization and the ideal of freedom.",https://www.imdb.com/title/tt0055758/?ref_=sr_i_279,,,
280. The Four Days of Naples,1962,2h,,7.6,1.1K,,"The film shows the history of the Neapolitan popular revolt against the invading Germans during World War II. During the four days in Naples, the revolt turns over in just a few hours. Neapolitans slung on rifles and guns or armed themselves with stones, house-objects, gasoline-bottles, anything and everything, anonymous and silent. Gennarino Capuozzo, a 10-year-old killed on a barricade while he was fighting against the invaders, is remembered as a hero.",https://www.imdb.com/title/tt0056389/?ref_=sr_i_280,,,
281. The Son of Captain Blood,1962,1h 28m,,5.2,203,,The son of a notorious pirate is placed on the path of righteousness by his love for a beautiful young woman.,https://www.imdb.com/title/tt0054875/?ref_=sr_i_281,,,
282. Crooks Anonymous,1962,1h 28m,,6.2,702,,"Forsdyke, a pathological petty thief subjects himself to a strict correction course run by a wealthy ex-con Widdowes and his Crooks Anonymous organization. Forsdyke's young and innocent girlfriend Babette, holds the hopes for his recovery and promises that she'll marry him if he'll reform. However, Forsdyke loses control when he's locked in a department store over Christmas.",https://www.imdb.com/title/tt0055875/?ref_=sr_i_282,,,
"283. Love, Thy Name Be Sorrow",1962,1h 49m,,7.2,493,,"In the reign of the Emperor Suzaku (930- 946 A.D.), various mishaps happen after a strange white rainbow in appearance in the sky over Kyoto. The Emperor orders a famous astronomer, Yasunori, to consult a certain Chinese book of secrets to calm the fear of the people. Yasunori has two disciples, Yasuna and Doman. But he desires that Yasuna succeeds him because Doman is interested only in power. Assisted by Yasunori's wife, Doman sends his follower, Akuemon, to kill Yasunori. Doman also steals the secret book and puts the blame on Yasuna and his sweetheart, Sakaki, Yasunori's adopted daughter. Sakaki commits suicide and Yasuna kills Yasunori's wife in his rage. He retrieves the secret book and sets out on a journey without destination. He meets her younger sister, Kuzunoha, with whom he falls in love at Sakaki's home town. Lord Iwakura, Yasunori's brother-in-low, advices the Court that the Crown Prince has no child and this causes tourmoils. Akuemon is summoned to catch a white female fox which is to be used for charming away the curse on the Prince. Akuemon fails to find a white female fox, but meets Yasuna who has protected the foxes. Akuemon beats Yasuna and takes Kuzunoha with him. But Yasuna is rescued by a white fox. The white fox asks his daughter to transform herself in the shape of Kuzunoha to live together with him. After that, they have a baby. When Kuzunoha escapes from Akuemon and comes to Yasuna, the female fox in the shape of Kuzunoha disappears leaving a poem (tanka) beside her sleeping baby.",https://www.imdb.com/title/tt0203629/?ref_=sr_i_283,,,
284. Convicts 4,1962,1h 45m,Approved,6.5,585,,"After his death sentence is commuted to life in prison, John Resko (Ben Gazzara) is transferred from Sing-Sing to Dannemora Prison where, with the help of a humane prison guard, he becomes a rehabilitated man and a successful painter.",https://www.imdb.com/title/tt0055868/?ref_=sr_i_284,,,
285. Gladiator of Rome,1962,1h 40m,,4.7,179,,"A warrior protecting a slave girl, who is really a princess, winds up as a gladiator in the Roman arenas.",https://www.imdb.com/title/tt0056026/?ref_=sr_i_285,,,
286. Das haben die Mädchen gern,1962,1h 31m,,4.8,29,,"Peter Monk, just called ""Pitt"" by everyone, is a spoiled young man who enjoys the joys of life at the expense of his father without worrying about possible consequences.",https://www.imdb.com/title/tt0055888/?ref_=sr_i_286,,,
287. Cinco vezes Favela,1962,1h 32m,,7.1,175,,Five segments about the hardships faced by people living in slums on hills in Rio de Janeiro.,https://www.imdb.com/title/tt0055287/?ref_=sr_i_287,,,
288. Diary of a Mad Old Man,1962,1h 38m,,7.0,98,,"A wealthy old man, Utsugi has recently suffered a stroke which has paralyzed his right hand and significantly reduced his quality of life. He currently operates a large household with a number of live-in staff, including a round the clock nurse, his wife, son, daughter-in-law, and grandson. The son, Joukichi, is a successful executive currently having an affair with a cabaret dancer, leaving his extremely beautiful wife, Sachiko, herself also formerly a dancer, at a loose end. Though approaching the end of his life and possibly physically incapable of acting on his desire, Utsugi is consumed with lust for Sachiko and thinks of little else but how to convince her to allow him even the smallest of intimacies. Sachiko, for her part, is not particularly interested in pursuing a romantic entanglement with her aged father-in-law but is perfectly aware of her power over him which she uses to fulfill her material desires. Meanwhile, Utsugi's rather pathetic behavior has not gone unnoticed by the rest of the household who view his desperation with a mix of pity, exasperation, and outrage.",https://www.imdb.com/title/tt0317538/?ref_=sr_i_288,,,
289. The Underwater City,1962,1h 18m,Not Rated,4.7,200,,"An engineer, a psychologist and several other disparate types take part in an experiment to see if people can live for extended periods of time in a city built under the ocean.",https://www.imdb.com/title/tt0056637/?ref_=sr_i_289,,,
290. Family Diary,1962,1h 53m,Not Rated,7.2,1.2K,,A man recollects the life of his late younger brother.,https://www.imdb.com/title/tt0056966/?ref_=sr_i_290,,,
291. A Girl Named Tamiko,1962,1h 50m,Approved,5.7,203,,A Eurasian photographer uses his women in an attempt to get American nationality.,https://www.imdb.com/title/tt0056021/?ref_=sr_i_291,,,
292. Safe at Home!,1962,1h 24m,Not Rated,5.5,379,,Legendary Hall of Famer Mickey Mantle stars with his Yankee teammate Roger Maris in this good-natured story of dreams that really do come true.,https://www.imdb.com/title/tt0056435/?ref_=sr_i_292,,,
293. Dr,1962,1h 27m,,7.8,217,,"In the moment when Belgrade industrialist Zivota Cvijovic had dreams to marry off his son Milorad, Doctor of Philosophy, to a minister of transport's daughter, a telegram from Milorad's professor from Heidelberg arrives, saying that he wants to visit them. Bad luck is that Velimir, a poor student, was financed by Milorad, and studying under his name received a diploma.",https://www.imdb.com/title/tt0057011/?ref_=sr_i_293,,,
294. Nudes of All Nations,1962,1h 5m,,5.3,47,,Old-fashioned nudist romp.,https://www.imdb.com/title/tt0195101/?ref_=sr_i_294,,,
"295. Vulcan, Son of Jupiter",1962,1h 16m,,4.2,236,,A superhero battles lizard men and other monsters that are terrorizing the countryside.,https://www.imdb.com/title/tt0055609/?ref_=sr_i_295,,,
296. Asli-Naqli,1962,2h 25m,,7.6,363,,"Renu lives a poor lifestyle with her mom, dad and a brother. Her dad decides to travel to Africa so that he can earn enough money to send his son to study engineering, so that he can find employment abroad. But fate has other plans when one day Renu's brother returns home sick from college, and shortly thereafter passes away. His shocked father books a seat on a plane to attend his son's funeral, but the plane crashes killing everyone on board. Shattered and devastated, Renu decides to hide her dad's death from her ill and fragile mom, and goes along pretending that her father is still alive. She obtains employment and through her earnings convinces her mom that her dad is regularly sending money. Then things brighten up when a homeless young man, Anand, enters her life, both fall in love with each other and want to get married. But once again fate plays a cruel joke on Renu as she subsequently finds out that Anand is not who he claims to be, but is in fact, a playboy, the grandson, nicknamed 'Prince"", of one of the wealthiest man in town, Dwarkadas, and Anand is scheduled to get married to Rekha - the only heir to a multi-million rupee estate. Watch as events unfold and the effect this news has on the townspeople and Renu's mom.",https://www.imdb.com/title/tt0244409/?ref_=sr_i_296,,,
297. Ulysses Against Hercules,1962,1h 39m,,5.0,245,,"Ulysses offends the gods by blinding the Cyclops, so they send Hercules to capture him and bring him to them.",https://www.imdb.com/title/tt0055564/?ref_=sr_i_297,,,
298. Dil Tera Diwana,1962,2h 30m,Not Rated,6.3,134,,"Wayward, brash, and disobedient Mohan (Shammi Kapoor) is sent by his angry dad Diwan Badriprasad (Ulhas) to a retired army captain Dayaram (Om Prakash) to learn some discipline and respect. But Mohan asks his friend Anokhe (Mehmood) to switch places with him, and Anokhe agrees to do so. Mohan meets with Meena (Mala Sinha), who lives with her blind dad (Manmohan Krishan). Anokhe is welcomed as Mohan by Captain Dayaram and his daughter Malti (Shubha Khote) in their household. Eventually both Malti and Anokhe fall in love. Things start to get even more muddled when Captain Dayaram finds out that Anokhe is married to another woman, and that Anokhe drives a rickshaw. The police are notified and they are asked to arrest Mohan - they arrest 3 Mohans. Who is the real Mohan?",https://www.imdb.com/title/tt0250339/?ref_=sr_i_298,,,
299. Terrified,1962,1h 21m,Approved,4.4,526,,A masked lunatic kills off people in a haunted house.,https://www.imdb.com/title/tt0142906/?ref_=sr_i_299,,,
300. Death Trap,1962,56m,,6.2,95,,"A young woman commits suicide. Her sister is not ready to let the death go without someone answering a few questions. was it really suicide, and where is the large amount of money her sister withdrew from the bank the day before her death?",https://www.imdb.com/title/tt1729182/?ref_=sr_i_300,,,
301. Daughter of the Sun,1962,1h 10m,Unrated,4.8,95,,"When she is discovered to be a nudist, a school teacher is called before the board of education to defend herself. A young male teacher decides to accompany her to her nudist camp to find out for himself exactly what goes on there.",https://www.imdb.com/title/tt0055890/?ref_=sr_i_301,,,
302. Alone Against Rome,1962,1h 40m,,5.7,122,,"A Roman Consul, on his way to fight a border war, stations a garrison of soldiers in a provincial town. The townspeople aren't happy with this situation but decide it's in their best interests to cooperate. However, the Tribune left in charge of the garrison proves to be cruel and demanding. He takes over a house for his own use and forces his attentions on Fabiola, the owner's daughter. She reluctantly submits in order to protect the life of her lover, Brenno, who's already been publicly whipped and who's been hauled off to the local arena to provide sport for Roman gladiators. Soon, Brenno and Fabiola's brother are organizing a resistance which will put an end to the Tribune's reign of tyranny.",https://www.imdb.com/title/tt0056507/?ref_=sr_i_302,,,
303. Pontius Pilate,1962,1h 40m,Not Rated,5.5,304,,"The events that culminated with the Passion of Christ seen from the perspective of Pontius Pilate, the Procurator of Judea who unwillingly condemned Christ to death. Based on the biblical Gospel of John.",https://www.imdb.com/title/tt0056358/?ref_=sr_i_303,,,
304. It Happened in Athens,1962,1h 40m,Approved,5.4,287,,"In 1896 it is announced that the Olympic Games will be revived in Athens. A young shepherd, Spiridon Loues, decides to enter the 26-mile marathon. Once in Athens, he meets Christina Gratsos, a young woman from his hometown who is now the personal maid of Eleni Costa, Greece's most glamorous actress. Though he has arrived after the qualification date, Spiridon's athletic prowess so impresses Coach Graham of the American team that he is permitted to enter the contest. Eleni informs the press that she will marry the victor, confident it will be her lover, Lieutenant Vinardos.",https://www.imdb.com/title/tt0056109/?ref_=sr_i_304,,,
305. Love Under the Crucifix,1962,1h 42m,,6.7,301,,"A tea master and his daughter Ogin are both Christians in feudal Japan. Ogin falls in love with a married feudal prince who shares her faith. When the Shogun bans Christianity, the situation worsens.",https://www.imdb.com/title/tt0203751/?ref_=sr_i_305,,,
306. Deka meres sto Parisi,1962,1h 29m,,5.5,97,,"Yearning to indulge themselves in forbidden pleasures, two incorrigible womanisers dream of going on a trip to seductive Paris without their wives; but, instead, they go together. Can ten days in Paris bring joy to the happy holidaymakers?",https://www.imdb.com/title/tt0196490/?ref_=sr_i_306,,,
307. Adorable Julia,1962,1h 37m,,6.7,171,,"A successful and married, although not quite young, actress at a London theatre, falls for a young man, only a little older than her son, involved with a young actress who uses him to advance her career and upstage the leading lady.",https://www.imdb.com/title/tt0056129/?ref_=sr_i_307,,,
308. The Door with Seven Locks,1962,1h 36m,,6.0,906,,"A woman arrives at a lonely mansion and finds herself mixed up with a lunatic who has built his own torture chamber, which is already crowded with victims - and he plans to make her his next one.",https://www.imdb.com/title/tt0056630/?ref_=sr_i_308,,,
309. China Town,1962,2h 31m,Not Rated,7.0,252,,A Darjeeling-based singer is asked to impersonate and take over the life of a Calcutta-based China Town gangster.,https://www.imdb.com/title/tt0268220/?ref_=sr_i_309,,,
310. Swordsman of Siena,1962,1h 37m,Approved,5.8,358,,"A Spanish overlord controls 16th-century Tuscany. He plans to marry into a prominent Italian family and hires an Englishman to serve as bodyguard for his less-than-eager fiancee. The bodyguard finds his allegiance switching to the rebels who seek to overthrow the Spaniard, even as he finds himself drawn to the woman he's been hired to protect.",https://www.imdb.com/title/tt0055865/?ref_=sr_i_310,,,
311. Los autómatas de la muerte,1962,1h 20m,,3.6,222,,"The evil scientist Dr. Caronte plots to revive the brains of three dead scientists and use them to obtain the formula for the super-powerful neutron bomb. The resulting creation needs blood lots of blood, sending Caronte's midget assistant Nick and his legion of mutant monsters out to get fresh victims. However, the masked atom-superman Neutron vows to put a stop to Caronte's deeds.",https://www.imdb.com/title/tt0053615/?ref_=sr_i_311,,,
312. Nomos 4000,1962,1h 36m,,6.8,488,,"As the Athenian Teddy Boys find creative ways to channel their resentment, the daughter of a puritanical philologist has a secret relationship with a student. Now, an unforeseen complication leads to a crisis. Is law 4.000 the solution?",https://www.imdb.com/title/tt0122636/?ref_=sr_i_312,,,
313. Paris Pick-Up,1962,1h 30m,,7.3,271,,"On Christmas night, ex-convict Robert Herbin meets a beautiful Italian married woman, Marthe Drévet, who has many secrets.",https://www.imdb.com/title/tt0056248/?ref_=sr_i_313,,,
314. Eighteen in the Sun,1962,1h 28m,,5.3,141,,"The film follows Nicole Molino, a French teenager on vacation at the Italian resort island of Ischia. She meets several other young Italian men also on vacation and looking for fun and romance. Confusion, comedy and romance ensue.",https://www.imdb.com/title/tt0055906/?ref_=sr_i_314,,,
315. Fallguy,1962,1h 4m,,4.7,171,,A teenager trying to help an accident victim finds himself enmeshed in political corruption and racketeering and charged with a murder he didn't commit.,https://www.imdb.com/title/tt0055974/?ref_=sr_i_315,,,
316. La mano de un hombre muerto,1962,1h 35m,Approved,5.9,676,,"When violent crime strikes a tiny hamlet, the townsfolk suspect the distant relative of a sadistic 17th century baron who cursed the village.",https://www.imdb.com/title/tt0056220/?ref_=sr_i_316,,,
317. The Amorous Mr. Prawn,1962,1h 29m,,5.6,198,,"General and Lady Fitzadam live at a remote army outpost in Scotland, their last assignment before the General retires. The General is sent abroad and in his absence, Lady Fitzadam decides to convert their spacious estate into a fishing resort for American tourists.",https://www.imdb.com/title/tt0055746/?ref_=sr_i_317,,,
318. Arsène Lupin contre Arsène Lupin,1962,1h 51m,,5.9,212,,"André Laroche, an industrialist, has just passed away. Face to his grave, as he is being buried, Anne de Vierne, the wife of a magistrate, confesses to her son François that Laroche was in fact Lupin and that he is his natural child. But he is not the gentleman thief's only offspring! Lupin had indeed another son by a housemaid, Gérard Dagmar, a dancer, magician and - occasionally - burglar. Which complicates the task of François who, to respect the last wishes of the testator, has gone in search of the treasure of Poldavia. For he keeps finding Gérard on his way and his efforts are constantly thwarted by his half-brother. Will Gérard prevent François from becoming the worthy successor to their father or will the two young men decide to join forces? That is the question.",https://www.imdb.com/title/tt0055759/?ref_=sr_i_318,,,
319. Akitsu Springs,1962,1h 53m,,7.2,1.2K,,"Just after WW2, a romance between an innkeeper and a man with tuberculosis unravels near a thermal spring.",https://www.imdb.com/title/tt0055732/?ref_=sr_i_319,,,
320. The Inn on the River,1962,1h 32m,,6.5,1.1K,,"Inspector Wade hunts down The Shark, a criminal equipped with a wetsuit and a speargun.",https://www.imdb.com/title/tt0056012/?ref_=sr_i_320,,,
321. Smog,1962,1h 44m,,7.3,115,,An ambitious Italian attorney has his flight delayed in Los Angeles. The vapid lawyer goes to some parties with some Italians living there and has a brief affair with a beautiful Italian expatriate.,https://www.imdb.com/title/tt0056502/?ref_=sr_i_321,,,
322. Stark Fear,1962,1h 26m,,5.5,510,,"A sadistic husband mentally tortures his wife, while eventually planning to murder her. Although no one believes her, she gets help from an unexpected source.",https://www.imdb.com/title/tt0055478/?ref_=sr_i_322,,,
323. The King of Gaffes,1962,1h 19m,,6.3,92,,"Assigned the task of finding a young heiress, a maladroit private investigator embarks on a quest in Kos with his beautiful assistant. There, a handsome antagonist has set his sights on finding her first. Will the king of gaffes succeed?",https://www.imdb.com/title/tt0184984/?ref_=sr_i_323,,,
324. Bombay Ka Chor,1962,,,7.1,26,,"Randhir has been an orphan, and lived all his younger life in an orphanage. When he grew up, he took to stealing as a career, and has been on the run from the police since then. One day he comes across a dead body, which resembles his face, and he assumes that person's identity, leaving the police to conclude that Randhir is dead. Randhir, now with a new identity finds out that his name is Kishore, who is wealthy beyond his imagination. He begans to live the easy life, and even has a pretty girlfriend, who he indeeds to marry. But then murphy's law steps in, and Randhir soon realises that he has landed himself in a soup, when the police come looking for Kishore, to charge him with murder.",https://www.imdb.com/title/tt0373731/?ref_=sr_i_324,,,
325. Black Whip Against the Impostors,1962,,,6.0,7,,"While the masked vigilante, Látigo Negro, is in the capital city buying cattle, Rogelio, a rich landowner, arrives in the town of San Fernando.",https://www.imdb.com/title/tt0277116/?ref_=sr_i_325,,,
326. Twice Round the Daffodils,1962,1h 29m,,6.3,402,,"A group of patients resides in a sanatorium and aspire to walk twice round the daffodils, which they can do when they are better.",https://www.imdb.com/title/tt0056621/?ref_=sr_i_326,,,
327. A Queen for Caesar,1962,1h 30m,,4.9,136,,"Story of the power struggle between Egyptian queen Cleopatra and her brother Ptolemy, and how a common soldier risks his life to serve her.",https://www.imdb.com/title/tt0056401/?ref_=sr_i_327,,,
328. Straße der Verheißung,1962,1h 33m,,5.5,19,,,https://www.imdb.com/title/tt0056531/?ref_=sr_i_328,,,
329. Tom Thumb and Little Red Riding Hood,1962,1h 22m,Not Rated,4.5,242,,"Follow up to Caperucita y sus tres amigos. Caperucita, the Wolf and the Ogre are captured by the Witch Queen, accused of treason by the Vampire. Caperucita, followed by a host of old and new characters begin the adventure to rescue their friends.",https://www.imdb.com/title/tt0053694/?ref_=sr_i_329,,,
330. Assault on the Pay Train,1962,1h 42m,,7.8,892,,"Film about the true events in Rio de Janeiro, in 1960, when a gang having the infamous outlaw Tião Medonho as a leader performed a sensational railroad hold-up on a train carrying a small fortune.",https://www.imdb.com/title/tt0056582/?ref_=sr_i_330,,,
331. The Elusive Corporal,1962,1h 30m,TV-PG,7.0,1.1K,,"An upper-class corporal from Paris is captured by the Germans when they invade France in 1940. Assisted and accompanied by characters as diverse as a morose dairy farmer, a waiter, a myopic intellectual, a working-class Parisian, and a German dental assistant, the corporal tries to escape from prison camps, sometimes making it a few yards, sometimes reaching the French border.",https://www.imdb.com/title/tt0055827/?ref_=sr_i_331,,,
332. Voyage to Danger,1962,1h 26m,,5.7,35,,German sailors track and destroy a spy net working for an Eastern country.,https://www.imdb.com/title/tt0056728/?ref_=sr_i_332,,,
