Title,Year,Duration,MPA,Rating,Votes,méta_score,description,Movie Link,writers,director,budget
181. Period of Adjustment,1962,1h 52m,Approved,6.2,1.7K,,A newlywed couple's honeymoon is disrupted by their friends' marital problems.,https://www.imdb.com/title/tt0056341/?ref_=sr_i_181,,,
182. The Spiral Road,1962,2h 19m,Approved,6.1,680,,"In 1936, a Dutch physician who treats leprosy patients in the jungles of Indonesia has a dangerous run-in with a local witch-doctor who uses black magic to kill his enemies.",https://www.imdb.com/title/tt0056516/?ref_=sr_i_182,,,
"183. Ninja, a Band of Assassins",1962,1h 44m,Not Rated,7.0,1K,,"A young ninja becomes embroiled in a plot to kill a tyrannical warlord. He journeys across feudal Japan, facing deceit, betrayal, and enemy ninja at every turn. Goemon must complete his mission, regain his honor, and survive.",https://www.imdb.com/title/tt0164882/?ref_=sr_i_183,,,
184. Adam and 6 Eves,1962,1h,,4.8,209,,A man lost in the desert with his donkey comes across an oasis with six naked women.,https://www.imdb.com/title/tt0206534/?ref_=sr_i_184,,,
185. The Inheritance,1962,1h 47m,,7.4,1.1K,,"A dying businessman intends to will two hundred million yen to his three illegitimate children, but his associates scheme to take advantage of the situation.",https://www.imdb.com/title/tt0056135/?ref_=sr_i_185,,,
186. The Three Stooges in Orbit,1962,1h 30m,Not Rated,5.6,1.1K,,The Stooges must battle alien spies to safeguard a goofy scientist's revolutionary new vehicle.,https://www.imdb.com/title/tt0056580/?ref_=sr_i_186,,,
187. Il mare,1962,1h 50m,,6.8,166,,"A well known actor comes to off-season Capri to unwind and meets a teenaged boy. The attraction is immediate and mutual but before their relationship can get off the ground, an alluring woman with a spontaneous sexuality and care free attitude joins the triangle and the boy is slowly pushed out of the picture.",https://www.imdb.com/title/tt0056223/?ref_=sr_i_187,,,
188. Le glaive et la balance,1962,2h 11m,,6.9,269,,"Three young men are suspected of kidnapping and murdering a little boy. Most likely, two of them are really involved, but one is not. Neither the police nor the court can decide how to solve that puzzle.",https://www.imdb.com/title/tt0057106/?ref_=sr_i_188,,,
189. Professor,1962,2h 46m,,6.8,361,,A college grad in need of money must disguise himself as an old man to tutor two young women who are under the watchful eye of their strict aunt.,https://www.imdb.com/title/tt0056379/?ref_=sr_i_189,,,
190. Main Chup Rahungi,1962,2h 27m,Not Rated,7.8,99,,"Gayatri, daughter of a poor labourer, falls in love with a rich businessman. But the relationship sours and she is left pregnant with his baby. She keeps the identity of the father a secret.",https://www.imdb.com/title/tt0056213/?ref_=sr_i_190,,,
191. The Treasure of the Silver Lake,1962,1h 22m,,6.8,3.7K,,"In their first cinematic adventure, Apache chief Winnetou and mountain man Old Shatterhand pursue a gang of murderous outlaws who will stop at nothing to find the legendary treasure of Silver Lake.",https://www.imdb.com/title/tt0056452/?ref_=sr_i_191,,,
192. Pressure Point,1962,1h 31m,Not Rated,7.1,2.2K,,A Black prison psychiatrist is assigned the distasteful task of helping a paranoid American Nazi charged with sedition.,https://www.imdb.com/title/tt0056370/?ref_=sr_i_192,,,
193. The Fabulous Baron Munchausen,1962,1h 23m,Not Rated,7.7,3.2K,,"The outrageous Baron Munchausen tells of his many adventures, from meeting the Man in the Moon to defeating a Turkish army all by himself.",https://www.imdb.com/title/tt0054665/?ref_=sr_i_193,,,
194. The Devil and the Ten Commandments,1962,2h 6m,,6.7,1K,,"1) Jerôme Chambard, a retired man, taken in by nuns in a convent, swears like a trooper. 2) Françoise takes a lover because he has promised her a diamond necklace. 3) Denis, a seminarist, decides to renounce his vows to avenge his sister. 4) God in person lands at a remote farm and works miracles there. 5) Pierre learns that his mother is not his mother, but a famous actress. 6) Didier, a bank clerk, teams up with a bank thief after being fired by the manager 7) Jerôme Chambard is invited to Sunday lunch by his friend the bishop and by dint of drinking to their friendship the holy man cannot remember the ten commandments anymore",https://www.imdb.com/title/tt0055904/?ref_=sr_i_194,,,
195. Maciste contro i mostri,1962,1h 22m,Not Rated,4.1,319,,"Wandering strongman Maxxus comes upon two warring tribes, the Sun worshipers and the Moon worshipers. He saves the leader of the Sun tribe from a sea monster, then later on when the Moon tribe attacks and kidnaps the Sun tribe's women, they call upon Maxxus for help.",https://www.imdb.com/title/tt0057270/?ref_=sr_i_195,,,
196. The Witch's Mirror,1962,1h 16m,Approved,6.5,1.1K,,"A husband murders his wife, and years later her ghost emerges from a witch's mirror to take her revenge.",https://www.imdb.com/title/tt0055966/?ref_=sr_i_196,,,
197. Young and Willing,1962,1h 50m,,5.9,187,,University students form relationships and perform pranks with disastrous consequences all round.,https://www.imdb.com/title/tt0056696/?ref_=sr_i_197,,,
198. Anak Perawan di Sarang Penjamun,1962,2h 7m,,,,,,https://www.imdb.com/title/tt6753458/?ref_=sr_i_198,,,
199. Tarzan Goes to India,1962,1h 28m,Approved,5.3,608,,"Summoned to India by a dying maharajah, Tarzan attempts to remove an elephant herd from a valley to be flooded upon completion of a modern dam.",https://www.imdb.com/title/tt0056560/?ref_=sr_i_199,,,
200. The Lion,1962,1h 36m,Approved,6.1,806,,"In Kenya, when young Tina befriends a lion and embraces local customs, her mother summons Tina's American father to help bring Tina back to civilization and give her a civilized upbringing.",https://www.imdb.com/title/tt0056186/?ref_=sr_i_200,,,
201. Number Six,1962,59m,,6.4,63,,The police have never been able to charge Mr Valentine but that doesn't mean he is a honest man. A policeman sets out to finally bring him to justice.....,https://www.imdb.com/title/tt7393284/?ref_=sr_i_201,,,
202. Moon Pilot,1962,1h 38m,Not Rated,5.4,545,,"Away on a short leave before an upcoming moon launch, a NASA astronaut disappears and is feared kidnapped when the security services learn about his friendship with a suspected foreign female spy.",https://www.imdb.com/title/tt0056249/?ref_=sr_i_202,,,
203. Lafayette,1962,2h 38m,Not Rated,6.0,197,,"During the American War of Independence, French officer and nobleman La Fayette comes to America's aid with men, money and weapons and becomes a Major-General under George Washington's command.",https://www.imdb.com/title/tt0055070/?ref_=sr_i_203,,,
204. Five Miles to Midnight,1962,1h 50m,Approved,6.2,1.3K,,"Lisa Macklin, an Italian woman, has a fight with her American husband Robert in a Paris night club. He leaves the next day for a business trip and Lisa says she does not want to see him again. She is with newspaperman Alan Stewart that evening when she learns Robert's plane has crashed with no survivors. Waking from sedation after the funeral, Lisa finds Robert in their flat, injured but alive. He was thrown clear of the crash by a lucky twist of fate. He now plans to collect the $120,000 insurance he took out at the airport. Once Lisa collects the money and turns it over to him, she will finally be rid of him. She attempts to get advice from Stewart, but he has been replaced by David Barnes. Lisa's life becomes a tortuous ordeal, at work, at home, faced with a fugitive husband and a growing love for David, who suspects everything. Finally her nightmare concludes when she finally gets the check and meets Robert. As they drive to the Belgian border, he reveals he never intended giving her up to Barnes or anyone else. If she dares go, he will tell the police all and she will be arrested--as accessory to fraud. Lisa realizes she must take the desperate step to freedom. Once taken, there is no turning back.",https://www.imdb.com/title/tt0056957/?ref_=sr_i_204,,,
205. Hitler,1962,1h 47m,Approved,5.7,377,,Biopic of Adolf Hitler focusing on his relationships with various women from 1923 to 1945.,https://www.imdb.com/title/tt0056072/?ref_=sr_i_205,,,
206. Beauty and the Beast,1962,1h 17m,Approved,4.7,323,,"Curse turns a handsome prince into a werewolf at night. A princess tries to help him, while his enemies plot to take his throne.",https://www.imdb.com/title/tt0055781/?ref_=sr_i_206,,,
207. The Rape of the Sabines,1962,1h 20m,,5.4,58,,The Sabine tribe battles Romulus in the early days of Rome after Romans seize their women as unwilling brides.,https://www.imdb.com/title/tt0339560/?ref_=sr_i_207,,,
208. Jacktown,1962,1h 2m,Not Rated,4.9,185,,A young delinquent is sent to prison for a statutory rape.,https://www.imdb.com/title/tt0182253/?ref_=sr_i_208,,,
209. Totò diabolicus,1962,1h 35m,,6.7,818,,"The Marquis Galeazzo di Torre Alta is murdered by a mysterious killer who calls himself Diabolicus. His heirs are his three brothers and a sister, but all of them except Monsignor Antonino di Torre Alta are killed by Diabolicus. The police are unable to solve the case, but when Antonino gives his inheritance to Pasquale Bonocore--illegitimate son of his father--and Pasquale is in prison and therefore can't be the killer, all the clues are in the hand of the police.",https://www.imdb.com/title/tt0056604/?ref_=sr_i_209,,,
210. Secret of the Red Orchid,1962,1h 24m,Not Rated,5.5,725,,Rival gangsters from Chicago move to London and attempt to extort money from rich Britons.,https://www.imdb.com/title/tt0055391/?ref_=sr_i_210,,,
211. The Password Is Courage,1962,1h 56m,Approved,6.8,1.6K,,"British N.C.O. Sergeant Major Charles Coward (Sir Dirk Bogarde) escapes from the Stalag VIII-B P.O.W. camp, and is mistakenly awarded with the Iron Cross by the Germans.",https://www.imdb.com/title/tt0056335/?ref_=sr_i_211,,,
212. The Doll,1962,1h 36m,,6.7,386,,"A lonely night watchman at a department store develops a fixation on one of the store's mannequins. He soon steals her and brings her to his home, where he can be with her all the time. One day, she comes to life...",https://www.imdb.com/title/tt0056649/?ref_=sr_i_212,,,
213. War Gods of Babylon,1962,1h 28m,Not Rated,5.1,170,,"Noble, wise King Sardanapolo and his more soft and naive younger brother Prince Sammash get into a bitter feud over the affections of sweet and alluring innocent peasant girl Mirra. Meanwhile, the treacherous and ruthlessly ambitious General Arbace plots against both siblings.",https://www.imdb.com/title/tt0056674/?ref_=sr_i_213,,,
214. The Reluctant Saint,1962,1h 45m,Not Rated,7.3,549,,"In 17th century Italy, a simple and clumsy young man joins a Franciscan order, pursues full priesthood and performs a miracle that eventually ensures his sainthood.",https://www.imdb.com/title/tt0056403/?ref_=sr_i_214,,,
215. Some People,1962,1h 33m,,6.3,332,,"The story of three teenaged tearaways Johnnie, Bill and Bert who find themselves at odds with society. Following a brush with the law they have a chance meeting with a local choirmaster who offers them a way of making good.",https://www.imdb.com/title/tt0056509/?ref_=sr_i_215,,,
216. The Man from the First Century,1962,1h 25m,,6.0,189,,"A workman is accidentally sent into outer space, where he meets an alien that can make himself invisible. They return to Earth in the year 2447. Complications ensue.",https://www.imdb.com/title/tt0056265/?ref_=sr_i_216,,,
217. The Interns,1962,2h,Approved,6.5,377,,Medical drama that focuses on the personal and professional conflicts of medical interns working under senior surgeons at a major hospital.,https://www.imdb.com/title/tt0056101/?ref_=sr_i_217,,,
218. Married Too Young,1962,1h 16m,Not Rated,4.8,153,,"Two high-school sweethearts get married, then find that married life isn't what they thought it would be. In their desperation, they get mixed up with a gang of car thieves.",https://www.imdb.com/title/tt0056225/?ref_=sr_i_218,,,
219. Maa Beta,1962,2h 18m,Not Rated,6.0,30,,"Dependent on his elder brother, Bishan, Ganga and his wife, Rameshwari, are abused and asked to leave. They work hard, set up their own business, and soon become wealthy enough to even support Bishan and his wife. A pregnant Rameshwari gets the news that her husband has been killed. She subsequently gives birth to a boy, who goes missing. Will Rameshwari be ever reunited with her son?",https://www.imdb.com/title/tt0355716/?ref_=sr_i_219,,,
220. Bees Saal Baad,1962,2h 38m,Not Rated,7.0,438,,"When a young man's family gets haunted by a spirit, he is warned not to return to his hometown, but he decides to investigate the issue.",https://www.imdb.com/title/tt0055783/?ref_=sr_i_220,,,
221. Marco Polo,1962,1h 35m,,5.2,188,,"Italian explorer rescues the daughter of the Mongol leader Kublai Khan, meets a hermit who has invented gunpowder and builds a cannon.",https://www.imdb.com/title/tt0055141/?ref_=sr_i_221,,,
222. The Witch's Curse,1962,1h 31m,,5.1,540,,Maciste travels to Hell to find a witch and make her undo a curse she put on the surface world.,https://www.imdb.com/title/tt0057268/?ref_=sr_i_222,,,
223. Hemingway's Adventures of a Young Man,1962,2h 25m,Approved,6.3,730,,An immature young man from Middle America grows to manhood after a cross-country journey and his military service in World War I.,https://www.imdb.com/title/tt0056063/?ref_=sr_i_223,,,
224. On the Beat,1962,1h 46m,,6.8,1.1K,,"Norman wants to be a policeman like his father was, but he fails the height test (amongst others). One day, he gets out his father's old uniform and walks the beat. This leads to a level of chaos that only Norman could cause.",https://www.imdb.com/title/tt0056307/?ref_=sr_i_224,,,
225. No Man Is an Island,1962,1h 54m,Approved,6.6,608,,"During the early Pacific war years, American seaman George Tweed is the only U.S. serviceman on Guam not captured by the Japanese forces.",https://www.imdb.com/title/tt0056283/?ref_=sr_i_225,,,
226. Five Finger Exercise,1962,1h 49m,Not Rated,6.3,285,,A long-married couple are at war with each other and with their teenage son and daughter. The presence of a handsome young tutor complicates and sensitizes the savage domestic tensions which arise as the secret emotions of members of the family are shockingly revealed.,https://www.imdb.com/title/tt0055987/?ref_=sr_i_226,,,
227. The Pirates of Blood River,1962,1h 27m,Approved,6.0,1.2K,,A group of ruthless pirates attack a seventeenth century Huguenot settlement on the Isle of Devon in search of treasure and will stop at nothing to obtain it.,https://www.imdb.com/title/tt0056350/?ref_=sr_i_227,,,
228. The Devil's Agent,1962,1h 17m,,6.0,126,,"In East Germany, a double agent falls for a beautiful young escapee from Hungary.",https://www.imdb.com/title/tt0054806/?ref_=sr_i_228,,,
229. Nine Days of One Year,1962,1h 51m,,7.5,1.3K,,Nuclear physicists are risking their lives for scientific achievements.,https://www.imdb.com/title/tt0054803/?ref_=sr_i_229,,,
230. Tales of Paris,1962,1h 40m,,6.1,170,,"The omnibus made of four separate romantic playlets, each with its own cast, director, and scenarist. ""The Tale of Ella,"" directed by Jacques Poitrenaud, stars Dany Saval as an ambitious nightclub performer who very nearly messes up her chances for success by bullying a mild-looking but important producer. ""The Tale of Antonia,"" directed by Michel Boisrond, finds housewife Dany Robin exacting a sweet revenge on her cheating husband. ""The Tale of Francoise,"" directed by Claude Barma, concerns the efforts of Francoise Arnoul to test the fidelity of her best friend's lover. And ""The Tale of Sophie,"" directed by Marc Allegret, features Catherine Deneuve as a goody-two-shoes who fabricates a torrid romance in order to be accepted by her sexually knowledgeable schoolmates.",https://www.imdb.com/title/tt0056333/?ref_=sr_i_230,,,
231. Young Guns of Texas,1962,1h 18m,Approved,4.9,291,,"A cowboy and 5 others pursue outlaws to recover stolen Union Army gold, while a revengeful rancher is it out to murder one of the pursuers.",https://www.imdb.com/title/tt0056710/?ref_=sr_i_231,,,
232. Caesar the Conqueror,1962,1h 43m,Not Rated,4.7,290,,Julius Caesar leads the Roman army to battle against rebels in Gaul.,https://www.imdb.com/title/tt0057105/?ref_=sr_i_232,,,
233. No Exit,1962,1h 25m,,6.7,176,,"A valet guides a man into a windowless, mirrorless hotel room with a single entrance. Two women join them, then the valet locks them inside. Trapped, the trio realizes they're in hell, anticipating a grim fate.",https://www.imdb.com/title/tt0056282/?ref_=sr_i_233,,,
234. War Hunt,1962,1h 23m,Approved,6.2,1.2K,,"Dispatched to the front lines during the Korean War, an idealistic American soldier discovers the horrors of combat and comes at odds with a psychopathic member of his platoon.",https://www.imdb.com/title/tt0056675/?ref_=sr_i_234,,,
235. The Swingin' Maiden,1962,1h 38m,,6.4,592,,"During a steam engine race, an American airline firm plans to buy a new British passenger plane, but the deal hits trouble when the designer and the daughter of the Airline owner take an instant dislike to each other after a crash.",https://www.imdb.com/title/tt0056105/?ref_=sr_i_235,,,
236. Only Two Can Play,1962,1h 46m,,6.6,1.4K,,"A frustrated librarian (Sellers) in Swansea, Wales is torn between his wife Jean (Maskell) and a glamorous married woman, Liz (Zetterling), who wants to have an affair.",https://www.imdb.com/title/tt0056308/?ref_=sr_i_236,,,
237. Escape from Zahrain,1962,1h 33m,Approved,6.0,848,,A hunted revolutionary leads a rag tag group of individuals through the desert in an attempt to elude the security forces and escape the fictitious Arab country of Zahrain.,https://www.imdb.com/title/tt0055963/?ref_=sr_i_237,,,
238. Strongroom,1962,1h 20m,Not Rated,7.2,675,,"Bank robbery goes awry, manager and cashier locked in vault. Robbers return after failed rescue attempt, race against time to free hostages before police arrive.",https://www.imdb.com/title/tt0055484/?ref_=sr_i_238,,,
239. The Brain,1962,1h 23m,,5.2,376,,"After the mysterious crash of a millionaire's private airplane, three scientists secretly harvest the dying man's brain and keep it alive in a laboratory in order to communicate with it through telepathy.",https://www.imdb.com/title/tt0056601/?ref_=sr_i_239,,,
240. The Broken Land,1962,1h,Approved,5.1,458,,"A loner cowboy gets entangled in a town's fight against a corrupt sheriff. His involvement with a local woman leads to violence, robbery, and murder, leaving the cowboy a wanted man pursued by a posse.",https://www.imdb.com/title/tt0055811/?ref_=sr_i_240,,,
241. Gorath,1962,1h 23m,Not Rated,5.7,934,,A Tokyo scientist and his colleagues shift Earth to avoid a red-hot planet on a collision course.,https://www.imdb.com/title/tt0056709/?ref_=sr_i_241,,,
242. The Avenger,1962,1h 35m,,5.3,495,,"Aeneas leads escapees from the Trojan war to new land in Italy, and must deal with new threats to his people.",https://www.imdb.com/title/tt0056174/?ref_=sr_i_242,,,
243. Martes y trece,1962,1h 25m,,4.5,66,,"Lola and Maria are two Spanish young ladies engaged to Franz and Pepe, all so eager to spend their honeymoon that the moment seems never to come, as all sorts of problems pave their way.",https://www.imdb.com/title/tt0055147/?ref_=sr_i_243,,,
244. The Black Candles,1962,2h 50m,,7.0,294,,"The film revolves around the young man, ""Ahmed"" (Saleh Selim) the young poet who was blinded in an accident while riding a horse when he saw the betrayal of his sweetheart, and then decided to live with his mother (Amina Rizk) and his friend, ""Abdul Muti"" (Fouad Elmohandes) in the countryside, and with his heart full of hatred for all women, he thought all women are the same then he meets his new nurse that would change everything in his life.",https://www.imdb.com/title/tt0371218/?ref_=sr_i_244,,,
245. Il commissario,1962,1h 49m,Not Rated,6.8,308,,"Popular Italian comic Alberto Sordi does an excellent job of creating a bumbling yet effective police inspector by the unlikely name of Dante Lombardozzi, in this entertaining comedy-murder mystery by director Luigi Comencini.",https://www.imdb.com/title/tt0055861/?ref_=sr_i_245,,,
246. Gundamma Katha,1962,2h 46m,,8.8,1.7K,,Gundamma has two children and a stepdaughter whom she mistreats; she hopes to get a 'resident' son-in-law who will look after the family; two brothers decide to teach the old woman a lesson.,https://www.imdb.com/title/tt0262455/?ref_=sr_i_246,,,
247. The Graceful Brute,1962,1h 36m,,7.3,453,,"A greedy, materialistic family attempts to cover-up the embezzlement committed by the son while keeping their other schemes active. They discover there are other, equally conniving players involved.",https://www.imdb.com/title/tt0217799/?ref_=sr_i_247,,,
248. The Wild Swans,1962,57m,,7.3,471,,"When a witch transforms her brothers into swans, a young princess must find a way to change them back.",https://www.imdb.com/title/tt0238938/?ref_=sr_i_248,,,
249. This Is Not a Test,1962,1h 13m,Not Rated,5.3,927,,A deputy sheriff stops motorists on a mountain road after police dispatch reports of a possible nuclear attack.,https://www.imdb.com/title/tt0183884/?ref_=sr_i_249,,,
250. Crazy Desire,1962,1h 50m,,6.8,569,,"A middle-aged and slightly conservative businessman meets a band of rowdy youths and is smitten by one named Francesca. He is pursuaded to join their party and even pay for most of it, as he finds himself strangely attracted to Francesca, who seems his complete opposite.",https://www.imdb.com/title/tt0056665/?ref_=sr_i_250,,,
251. We Joined the Navy,1962,1h 45m,Not Rated,5.5,254,,"This is the story of the riotous, romantic, exciting, astonishing and highly entertaining adventures of Lieutenant Commander ""Bodger"" Badger, R.N. (Kenneth More). An exceptionally likeable fellow, the Badger has one besetting sin, a shining honesty.",https://www.imdb.com/title/tt0056681/?ref_=sr_i_251,,,
252. Therese,1962,1h 49m,,7.1,666,,"Unhappy in her marriage to a boring man who doesn't love her, a woman plans to get rid of him by slowly increasing the dosage of his medication.",https://www.imdb.com/title/tt0056581/?ref_=sr_i_252,,,
253. Wild Guitar,1962,1h 32m,Not Rated,4.6,1.1K,,"Aspiring singer Bud meets dancer Vickie. He signs with shady manager McCauley. Bud achieves success but faces manipulation. Kidnapped, he reconciles with Vickie, confronts McCauley with evidence, forcing honest management.",https://www.imdb.com/title/tt0056693/?ref_=sr_i_253,,,
254. Lulu,1962,1h 40m,,6.7,115,,"A 14-year-old girl is caught while trying to pick a doctor's pocket. The doctor ends up taking her in and turning her into a sophisticated lady, whom he marries off to a wealthy man.",https://www.imdb.com/title/tt0056202/?ref_=sr_i_254,,,
255. Una vita violenta,1962,1h 46m,,6.8,262,,"Tommaso Puzzilli is a boy who grew up in the suburb of Pietralata outside Rome. Not having a job, Tommaso and his friends are committing crimes to make money.",https://www.imdb.com/title/tt0139728/?ref_=sr_i_255,,,
256. Planets Around Us,1962,1h 25m,,4.6,162,,"An alien race sends cyborgs--made to look like the son of a famous scientist, whom they killed when he landed on their planet--to Earth to help pave the way for an invasion.",https://www.imdb.com/title/tt0055297/?ref_=sr_i_256,,,
257. Go to Blazes,1962,1h 20m,,5.9,276,,"After yet another smash-and-grab goes wrong, a bungling trio of small-time crooks flash an idea of using a fire engine as a getaway vehicle. But they keep being mistaken for genuine firemen and it starts to become a flaming nuisance.",https://www.imdb.com/title/tt0056032/?ref_=sr_i_257,,,
258. Fury of Achilles,1962,1h 58m,,5.7,371,,"In the tenth year of the Trojan War, tensions between Achilles and Agamemnon divide the Greek camp while giving hope to the Trojans.",https://www.imdb.com/title/tt0056104/?ref_=sr_i_258,,,
259. Hero's Island,1962,1h 34m,Approved,5.5,326,,"In 1718, on a small island off the Carolina coast, a recently freed family of indentured servants plans to settle and homestead there but they run into conflict with a group of fishermen also claiming ownership of the island.",https://www.imdb.com/title/tt0056065/?ref_=sr_i_259,,,
260. The Fury of Hercules,1962,1h 37m,,4.6,250,,In a tyrannical kingdom there is an evil ruler and a queen who lusts after Hercules who is attracted to a handmaiden. A rebellion overthrows the ruler.,https://www.imdb.com/title/tt0054903/?ref_=sr_i_260,,,
261. The Iron Mask,1962,2h 7m,,5.8,625,,"The story of the Three Musketeers, D'Artagnan, and the imprisonment in an iron mask of the identical twin of the King of France, Louis XIV.",https://www.imdb.com/title/tt0056228/?ref_=sr_i_261,,,
262. It's Only Money,1962,1h 23m,Not Rated,6.3,1.1K,,A TV repairman dreams of being a detective and sets out to locate a missing heir.,https://www.imdb.com/title/tt0056110/?ref_=sr_i_262,,,
263. Careless,1962,1h 51m,,7.1,328,,"The place is Trieste and the time is 1927. Emilio Brentani leads a peaceful and uneventful life with his older sister Amalia. At least until the day he meets Angiolina Zarri, a beautiful young woman. But the lady is also fickle, wayward and coquettish. Unfortunately for him, Emilio falls madly in love with her...",https://www.imdb.com/title/tt0055432/?ref_=sr_i_263,,,
264. Hand of Death,1962,1h,Approved,4.7,610,,"Alex Marsh has created a serum combining a hypnotic drug and nerve gas. Unfortunately spills the formula, breathing the vapors and getting some on his hands causing the drug transforms him into a murderous monster.",https://www.imdb.com/title/tt0056055/?ref_=sr_i_264,,,
265. Dikaya sobaka Dingo,1962,1h 37m,,7.2,188,,"Things take an interesting turn for Tanya and her mother when her father arrives with his foster son Kolya and new wife. This film is about Kolya and Tanya's bright, pure and bitter first love.",https://www.imdb.com/title/tt0167896/?ref_=sr_i_265,,,
