Title,Year,Duration,MPA,Rating,Votes,méta_score,description,Movie Link,writers,director,budget
192. A Taxi Driver,2017,2h 17m,Not Rated,7.9,34K,,"A widowed father and taxi driver who drives a German reporter from Seoul to Gwangju to cover the 1980 uprising, soon finds himself regretting his decision after being caught in the violence around him.",https://www.imdb.com/title/tt6878038/?ref_=sr_i_192,,,
193. The Square,2017,2h 31m,R,7.1,79K,,A prestigious Stockholm museum's chief art curator finds himself in times of both professional and personal crisis as he attempts to set up a controversial new exhibit.,https://www.imdb.com/title/tt4995790/?ref_=sr_i_193,,,
194. Genesis: Paradise Lost,2017,2h 10m,PG,5.1,827,,"If there is one part of the Bible that has undergone more scrutiny and abuse than any other, it is the very beginning-GENESIS. Both from within and without the church, assaults on GENESIS continue to question the Creation and ultimately the Creator. So, what exactly happened at the ""Creation,"" at the ""Beginning?"" Creation Today and Seven Fold Films is proud to announce that for the first time ever, using stunning visual effects and the latest in scientific research, GENESIS will come to life right before your very eyes. We have heard the phrase ""In the beginning"" many times; now we get to see it on the big screen.",https://www.imdb.com/title/tt7522002/?ref_=sr_i_194,,,
195. Judwaa 2,2017,2h 25m,TV-14,3.7,12K,,Prem and Raja are twin brothers who are seperated at birth but are uniquely connected to eachother via their reflexes. They reunite as adults and set out to take down the underground smuggling world.,https://www.imdb.com/title/tt5456546/?ref_=sr_i_195,,,
196. Finding Your Feet,2017,1h 51m,PG-13,6.8,7.4K,,"On the eve of retirement a middle class, judgmental snob discovers her husband has been having an affair with her best friend and is forced into exile with her bohemian sister who lives on an impoverished inner-city council estate.",https://www.imdb.com/title/tt4538916/?ref_=sr_i_196,,,
197. Wonder Wheel,2017,1h 41m,PG-13,6.2,32K,,"On Coney Island in the 1950s, a lifeguard tells the story of a middle-aged carousel operator, his beleaguered wife and the visitor who turns their lives upside-down.",https://www.imdb.com/title/tt5825380/?ref_=sr_i_197,,,
198. My Friend Dahmer,2017,1h 47m,R,6.2,24K,,A young Jeffrey Dahmer struggles to belong in high school.,https://www.imdb.com/title/tt2291540/?ref_=sr_i_198,,,
199. The Bookshop,2017,1h 53m,PG,6.5,18K,,"England 1959. In a small East Anglian town, Florence Green decides, against polite but ruthless local opposition, to open a bookshop.",https://www.imdb.com/title/tt3127022/?ref_=sr_i_199,,,
200. The Dinner,2017,2h,R,4.5,9.9K,,Two sets of wealthy parents meet for dinner to decide what to do about a crime their sons have committed.,https://www.imdb.com/title/tt3203620/?ref_=sr_i_200,,,
201. Jab Harry Met Sejal,2017,2h 23m,,5.1,23K,,A depressed middle-aged tour guide who lives in his own bubble gets another chance to experience and face reality through a chirpy girl.,https://www.imdb.com/title/tt5997666/?ref_=sr_i_201,,,
202. Churchill,2017,1h 45m,PG,6.0,16K,,"Ninety-six hours before the World War II invasion of Normandy, British Prime Minister Winston Churchill struggles with his severe reservations with Operation Overlord and his increasingly marginalized role in the war effort.",https://www.imdb.com/title/tt2674454/?ref_=sr_i_202,,,
203. Maria By Callas,2017,1h 59m,PG,7.2,2.2K,,"An intimate look at the life and work of Greek-American opera singer Maria Callas, as told in her own words.",https://www.imdb.com/title/tt7364566/?ref_=sr_i_203,,,
204. 3 Idiots,2017,1h 46m,PG-13,4.4,1.6K,,A group of friends embark on a fun adventure determined to find a college roommate who disappeared without a trace on graduation day.,https://www.imdb.com/title/tt3685624/?ref_=sr_i_204,,,
205. The Sense of an Ending,2017,1h 48m,PG-13,6.4,7.8K,,A man becomes haunted by his past and is presented with a mysterious legacy that causes him to re-think his current situation in life.,https://www.imdb.com/title/tt4827986/?ref_=sr_i_205,,,
206. Steve McQueen: American Icon,2017,2h,Not Rated,7.1,234,,"Steve McQueen truly is an American Icon. One of America's most endearing and intriguing movie stars, he ""is still the King of Cool"" according to Esquire Magazine-50 years after the zenith of his career. The strangest thing about him, however, is barely known, despite countless biographies and articles. Steve McQueen was a believer in Jesus Christ. On the surface McQueen had everything he could want-fame, cars, homes, more money than he could spend in a lifetime. An avid fan of the actor (and owner of a replica of McQueen's car in the classic film Bullitt), Pastor Greg Laurie hits the road in his mint Mustang, traveling the country in search of the true, untold story of McQueen's redemption-filled final chapters.",https://www.imdb.com/title/tt7424358/?ref_=sr_i_206,,,
207. 33 & Beyond: The Royal Art of Freemasonry,2017,1h 30m,,5.2,186,,An unprecedented journey into the world of Freemasonry.,https://www.imdb.com/title/tt5265492/?ref_=sr_i_207,,,
208. Lean on Pete,2017,2h 1m,R,7.1,14K,,"A teenager gets a summer job working for a horse trainer and befriends the fading racehorse, Lean on Pete.",https://www.imdb.com/title/tt5340300/?ref_=sr_i_208,,,
209. The Trip to Spain,2017,1h 48m,Unrated,6.6,6.5K,,"Actors Steve Coogan and Rob Brydon embark on a six-part episodic road trip through Europe. This time they're in Spain, sampling the restaurants, eateries, and sights along the way.",https://www.imdb.com/title/tt6193424/?ref_=sr_i_209,,,
210. Step,2017,1h 24m,PG,7.0,1.2K,,STEP documents the senior year of a girls' high-school step dance team against the background of inner-city Baltimore.,https://www.imdb.com/title/tt5758404/?ref_=sr_i_210,,,
211. Viceroy's House,2017,1h 46m,Not Rated,6.7,8.7K,,"The final Viceroy of India, Louis Francis Albert Victor Nicholas Mountbatten, 1st Earl Mountbatten of Burma (Hugh Bonneville), is tasked with overseeing the transition of British India to independence, but meets with conflict as different sides clash in the face of monumental change.",https://www.imdb.com/title/tt4977530/?ref_=sr_i_211,,,
212. The Dawn Wall,2017,1h 40m,Not Rated,8.1,22K,,"In an unbelievable story of perseverance, free climber Tommy Caldwell and climbing partner Kevin Jorgeson attempt to scale the impossible 3000ft Dawn Wall of El Capitan.",https://www.imdb.com/title/tt7286916/?ref_=sr_i_212,,,
213. Wonderstruck,2017,1h 56m,PG,6.2,11K,,"Tells the tale of two children separated by fifty years. In 1927, Rose searches for the actress whose life she chronicles in her scrapbook; in 1977, Ben runs away from home to find his father.",https://www.imdb.com/title/tt5208216/?ref_=sr_i_213,,,
214. Film Stars Don't Die in Liverpool,2017,1h 45m,R,6.7,11K,,A romance sparks between a young actor and a Hollywood leading lady.,https://www.imdb.com/title/tt5711148/?ref_=sr_i_214,,,
215. Columbus,2017,1h 40m,Not Rated,7.2,22K,,"A Korean-born man finds himself stuck in Columbus, Indiana, where his architect father is in a coma. The man meets a young woman who wants to stay in Columbus with her mother, a recovering addict, instead of pursuing her own dreams.",https://www.imdb.com/title/tt5990474/?ref_=sr_i_215,,,
216. Grow House,2017,1h 36m,R,4.6,513,,Two guys start a risky new business to pay off a debt.,https://www.imdb.com/title/tt4274656/?ref_=sr_i_216,,,
217. Perfect Strangers,2017,1h 37m,,6.9,16K,,"Seven lifelong friends, a dinner, a blood red moon eclipse, a game involving to read the seven cell phones' incoming messages. A night where anything that can be bad will be very bad.",https://www.imdb.com/title/tt6101820/?ref_=sr_i_217,,,
218. Golmaal Again,2017,2h 20m,Not Rated,5.0,11K,,The gang encounters with some spiritual bodies and finds out the truth about the Jamnadas Orphanage where they were brought up.,https://www.imdb.com/title/tt1806913/?ref_=sr_i_218,,,
219. 1945,2017,1h 31m,,7.1,4.4K,,"12 August 1945, 11 AM. Two mysterious strangers dressed in black appear at the railway station of a Hungarian village. Within a few hours, everything changes.",https://www.imdb.com/title/tt5815492/?ref_=sr_i_219,,,
220. The Insult,2017,1h 53m,R,7.6,18K,,"After an emotional exchange between a Lebanese Christian and a Palestinian refugee escalates, the men end up in a court case that gets national attention.",https://www.imdb.com/title/tt7048622/?ref_=sr_i_220,,,
221. Last Flag Flying,2017,2h 5m,R,6.9,29K,,"Thirty years after they served together in Vietnam, a former Navy Corpsman Larry ""Doc"" Shepherd re-unites with his old buddies, former Marines Sal Nealon and Reverend Richard Mueller, to bury his son, a young Marine killed in the Iraq War.",https://www.imdb.com/title/tt6018306/?ref_=sr_i_221,,,
222. Lucky,2017,1h 28m,Not Rated,7.3,27K,,Lucky follows the spiritual journey of a 90-year-old atheist and the quirky characters that inhabit his off the map desert town.,https://www.imdb.com/title/tt5859238/?ref_=sr_i_222,,,
223. Faces Places,2017,1h 34m,PG,7.8,14K,,Director Agnes Varda and photographer/muralist J.R. journey through rural France and form an unlikely friendship.,https://www.imdb.com/title/tt5598102/?ref_=sr_i_223,,,
224. Landline,2017,1h 37m,R,6.4,5K,,"In 1995, a teenager living with her sister and parents in Manhattan discovers that her father is having an affair.",https://www.imdb.com/title/tt5737862/?ref_=sr_i_224,,,
225. Tubelight,2017,2h 16m,Not Rated,3.9,22K,,"A story of two brothers set during the Sino-Indian war, 1962: the younger one who's at war at the borders and the elder who's at war with his own world.",https://www.imdb.com/title/tt5882970/?ref_=sr_i_225,,,
226. The Broken Key,2017,2h 5m,,2.4,449,,"In a near future, due to the effects of an uncompromising law on the eco-sustainability of supports, paper has become a rare item, a luxury possession, controlled by the ""Big Z"": Zimurgh Corporation.",https://www.imdb.com/title/tt4656810/?ref_=sr_i_226,,,
227. Journey to the West: The Demons Strike Back,2017,1h 49m,PG-13,5.4,3.7K,,A monk and his three disciples continue on their journey to battle demons.,https://www.imdb.com/title/tt5273624/?ref_=sr_i_227,,,
228. The Cakemaker,2017,1h 53m,Not Rated,7.3,5.2K,,A German pastry maker travels to Jerusalem in search of the wife and son of his dead lover.,https://www.imdb.com/title/tt4830786/?ref_=sr_i_228,,,
229. Let the Sunshine In,2017,1h 34m,Not Rated,6.0,7.9K,,"Isabelle, Parisian artist, divorced mother, is looking for love, true love at last.",https://www.imdb.com/title/tt6423776/?ref_=sr_i_229,,,
230. The Ex-File 3: Return of the Exes,2017,2h,PG-13,5.5,597,,A couples relationship is tested by the untimely appearances of their exes!,https://www.imdb.com/title/tt7830888/?ref_=sr_i_230,,,
231. Bombshell: The Hedy Lamarr Story,2017,1h 28m,,7.4,4.5K,,"The life and career of the hailed Hollywood movie star and underappreciated genius inventor, Hedy Lamarr.",https://www.imdb.com/title/tt6752848/?ref_=sr_i_231,,,
232. Beast,2017,1h 47m,R,6.8,16K,,A troubled woman living in an isolated community finds herself pulled between the control of her oppressive family and the allure of a secretive outsider suspected of a series of brutal murders.,https://www.imdb.com/title/tt5628302/?ref_=sr_i_232,,,
233. Patti Cake$,2017,1h 49m,R,6.8,11K,,"PATTI CAKE$ is centered on aspiring rapper Patricia Dombrowski, a.k.a. Killa P, a.k.a. Patti Cake$, who is fighting an unlikely quest for glory in her downtrodden hometown in New Jersey.",https://www.imdb.com/title/tt6288250/?ref_=sr_i_233,,,
234. Mark Felt: The Man Who Brought Down the White House,2017,1h 43m,PG-13,6.4,15K,,"The story of Mark Felt, who under the name ""Deep Throat"" helped journalists Bob Woodward and Carl Bernstein uncover the Watergate scandal in 1972.",https://www.imdb.com/title/tt5175450/?ref_=sr_i_234,,,
235. Mubarakan,2017,2h 36m,PG-13,5.6,4.4K,,"Singleton Kartar Singh is left with the responsibility of raising his 2 orphaned nephews. He asks his brother to raise Charan and his sister in London to raise Karan. When the twins cross continents, they leave behind a trail of confusion.",https://www.imdb.com/title/tt6272828/?ref_=sr_i_235,,,
236. The Party,2017,1h 11m,R,6.5,22K,,"Janet hosts a party to celebrate her new promotion, but once the guests arrive, it becomes clear that not everything will be going down as smoothly as the red wine.",https://www.imdb.com/title/tt5814592/?ref_=sr_i_236,,,
237. On Chesil Beach,2017,1h 50m,R,6.3,13K,,"In 1962 England, a young couple find their idyllic romance colliding with issues of sexual freedom and societal pressure, leading to an awkward and fateful wedding night.",https://www.imdb.com/title/tt1667321/?ref_=sr_i_237,,,
238. Walk With Me,2017,1h 34m,,6.3,1.1K,,'Walk With Me' is a meditative film about a community of Zen Buddhist monks and nuns who have dedicated their lives to mastering the art of mindfulness with their world-famous teacher Thich Nhat Hanh.,https://www.imdb.com/title/tt2331100/?ref_=sr_i_238,,,
239. May it Last: A Portrait of the Avett Brothers,2017,1h 44m,Not Rated,8.3,799,,"An intimate documentary following acclaimed North Carolina band the Avett Brothers, as they create their 2016 hit album ""True Sadness.""",https://www.imdb.com/title/tt6487050/?ref_=sr_i_239,,,
240. Shubh Mangal Savdhan,2017,1h 59m,Not Rated,6.9,11K,,"In this remake of Kalyana Samayal Saadham (2013), a couple falls in love, but then the groom discovers that he suffers from erectile dysfunction.",https://www.imdb.com/title/tt6971752/?ref_=sr_i_240,,,
241. Wilson,2017,1h 34m,R,5.8,11K,,"A lonely, neurotic, and hilariously honest middle-aged man reunites with his estranged wife, and meets his teenage daughter for the first time.",https://www.imdb.com/title/tt1781058/?ref_=sr_i_241,,,
242. The Only Living Boy in New York,2017,1h 29m,R,6.4,18K,,"Adrift in New York City, a recent college graduate's life is upended by his father's mistress.",https://www.imdb.com/title/tt0460890/?ref_=sr_i_242,,,
243. Foxtrot,2017,1h 53m,R,7.2,8.2K,,A troubled family must face the facts when something goes terribly wrong at their son's desolate military post.,https://www.imdb.com/title/tt6896536/?ref_=sr_i_243,,,
244. Itzhak,2017,1h 22m,Not Rated,7.4,362,,"A look at the life, work and religious heritage of violinist Itzhak Perlman.",https://www.imdb.com/title/tt6186232/?ref_=sr_i_244,,,
245. The Midwife,2017,1h 57m,Unrated,6.7,3.1K,,"Claire is a wonderfully gifted midwife, with a natural talent to deliver babies with the most gentle touch. One day she receives a strange phone call. Béatrice, the extravagant mistress of her deceased father, wants to see her again.",https://www.imdb.com/title/tt5348236/?ref_=sr_i_245,,,
246. Novitiate,2017,2h 3m,R,6.7,5.3K,,"Set in the early 1960s and during the era of Vatican II, a young woman in training to become a nun struggles with issues of faith, the changing church and sexuality.",https://www.imdb.com/title/tt4513316/?ref_=sr_i_246,,,
247. Battle of Memories,2017,1h 59m,,6.4,1.2K,,"After undergoing a procedure to erase his memories, a successful author begins having unexplained recollections relating to a series of unsolved murders.",https://www.imdb.com/title/tt5636668/?ref_=sr_i_247,,,
248. Loveless,2017,2h 7m,R,7.6,36K,,A couple going through a divorce must team up to find their son who has disappeared during one of their bitter arguments.,https://www.imdb.com/title/tt6304162/?ref_=sr_i_248,,,
249. Samaritan's Purse presents Facing Darkness,2017,1h 33m,Unrated,7.5,95,,"A Christian relief organization is met with the challenge of fighting the Ebola epidemic in west Africa, through this enormous challenge their faith grew.",https://www.imdb.com/title/tt5835100/?ref_=sr_i_249,,,
250. Dolores,2017,1h 35m,Not Rated,7.3,385,,"In the 1950's, a working-class wife and mother of eleven children helps to establish a farmer's union, which later develops into a platform for feminism and gender equality.",https://www.imdb.com/title/tt6013154/?ref_=sr_i_250,,,
251. Anna and the Apocalypse,2017,1h 33m,R,6.1,16K,,"A zombie apocalypse threatens the sleepy town of Little Haven - at Christmas - forcing Anna and her friends to fight, slash and sing their way to survival, facing the undead in a desperate race to reach their loved ones. But they soon discover that no one is safe in this new world, and with civilization falling apart around them, the only people they can truly rely on are each other.",https://www.imdb.com/title/tt6433880/?ref_=sr_i_251,,,
252. Brigsby Bear,2017,1h 37m,PG-13,7.3,18K,,"After being freed from his life in an underground bunker, a man sets out to make a movie of the only TV show he has ever known.",https://www.imdb.com/title/tt5805752/?ref_=sr_i_252,,,
253. Human Flow,2017,2h 20m,PG-13,7.2,2.8K,,Human Flow is director and artist Ai Weiwei's detailed and heartbreaking exploration into the global refugee crisis.,https://www.imdb.com/title/tt6573444/?ref_=sr_i_253,,,
254. Fireworks,2017,1h 30m,TV-PG,5.5,4K,,"In this sci-fi tinged story of young love and teenage turmoil, a mysterious glowing ball offers Norimichi a second chance at securing his dream date.",https://www.imdb.com/title/tt6317962/?ref_=sr_i_254,,,
255. The Children Act,2017,1h 45m,R,6.7,16K,,"As her marriage crumbles, a judge must decide a case involving a teenage boy who is refusing a blood transfusion on religious principle.",https://www.imdb.com/title/tt6040662/?ref_=sr_i_255,,,
256. Jagga Jasoos,2017,2h 41m,TV-14,6.4,12K,,"Join Jagga, a gifted teenage detective, who along with a female companion, is on a quest to find his missing father.",https://www.imdb.com/title/tt4129428/?ref_=sr_i_256,,,
257. Breathe,2017,1h 58m,PG-13,7.1,25K,,"The inspiring true love story of Robin and Diana Cavendish, an adventurous couple who refuse to give up in the face of a devastating disease.",https://www.imdb.com/title/tt5716464/?ref_=sr_i_257,,,
258. Once Upon A Time,2017,1h 49m,,5.1,1.6K,,"Bai Qian is a Queen who lives in a Peach Blossom forest. Suffering from memory loss, she is invited to a party where she encounters people who recognize her. Her lover, Ye Hua had been searching for her, and now he must win her love back.",https://www.imdb.com/title/tt6138688/?ref_=sr_i_258,,,
259. Confidential Assignment,2017,2h 4m,Not Rated,6.7,4.8K,,"When a crime organization from North Korea crosses borders and enters South Korean soil, a South Korean detective must cooperate with a North Korean detective to investigate their whereabouts.",https://www.imdb.com/title/tt5606538/?ref_=sr_i_259,,,
260. Beach Rats,2017,1h 38m,R,6.4,17K,,A Brooklyn teenager spends his days experimenting with drugs and looking online for older men to meet.,https://www.imdb.com/title/tt6303866/?ref_=sr_i_260,,,
261. Duckweed,2017,1h 42m,,6.4,1.7K,,"In the near-death after an accident, a sports car driver time-travelled back to the 1990s to meet his severe father and never-seen mother in a small Chinese town.",https://www.imdb.com/title/tt6461514/?ref_=sr_i_261,,,
262. Final Portrait,2017,1h 30m,R,6.2,6.2K,,The story of Swiss painter and sculptor Alberto Giacometti.,https://www.imdb.com/title/tt4494718/?ref_=sr_i_262,,,
263. Scotty and the Secret History of Hollywood,2017,1h 38m,Unrated,6.7,1.9K,,"A portrait of unsung Hollywood legend Scotty Bowers, whose bestselling memoir chronicled his decades spent as sexual procurer to the stars.",https://www.imdb.com/title/tt2773246/?ref_=sr_i_263,,,
264. Phillauri,2017,2h 18m,,6.1,4.2K,,"A man must marry a tree to ward off threats to his love-life, but the tree turns out to have more spirit than the man bargained for.",https://www.imdb.com/title/tt5502766/?ref_=sr_i_264,,,
265. Chasing the Dragon,2017,2h 8m,,6.7,4.7K,,"An illegal immigrant from Mainland China sneaks into corrupt British-colonized Hong Kong in 1963, transforming himself into a ruthless and emerging drug lord.",https://www.imdb.com/title/tt6015328/?ref_=sr_i_265,,,
266. Condorito: The Movie,2017,1h 28m,PG,5.3,978,,Condorito embarks in a hilarious adventure to save the planet and his loved ones from an evil alien.,https://www.imdb.com/title/tt4494382/?ref_=sr_i_266,,,
267. Song to Song,2017,2h 9m,R,5.6,23K,,"Two intersecting love triangles. Obsession and betrayal set against the music scene in Austin, Texas.",https://www.imdb.com/title/tt2062700/?ref_=sr_i_267,,,
268. A Gentleman,2017,2h 25m,,6.3,7.6K,,"Gaurav, a simple hard working guy for a white collar job visits Mumbai for a meeting where his doppelganger is about to bring chaos in his life.",https://www.imdb.com/title/tt5613834/?ref_=sr_i_268,,,
269. A Bag of Marbles,2017,1h 50m,Not Rated,7.3,6.7K,,"In occupied France, Maurice and Joseph, two young Jewish brothers left to their own devices demonstrate an incredible amount of cleverness, courage, and ingenuity to escape the enemy invasion and to try to reunite their family once again.",https://www.imdb.com/title/tt5091612/?ref_=sr_i_269,,,
"270. Love, Kennedy",2017,1h 32m,PG,6.7,742,,A teenage girl copes with her diagnosis of terminal juvenile Batten Disease.,https://www.imdb.com/title/tt6261048/?ref_=sr_i_270,,,
271. The Invisibles,2017,1h 50m,,7.2,1.8K,,"While Joseph Goebbels infamously declared Berlin ""free of Jews"" in 1943, 1,700 managed to survive in the Nazi capital through the end of WWII. The Invisibles traces the stories of four young people who learned to hide in plain sight.",https://www.imdb.com/title/tt5586052/?ref_=sr_i_271,,,
"272. The Night Is Short, Walk on Girl",2017,1h 32m,,7.5,6.6K,,"In this comedy about one epic night in Kyoto, a college sophomore goes on a series of surreal encounters with the local nightlife, all the while unaware of the romantic longings of her classmate Senpai.",https://www.imdb.com/title/tt6335734/?ref_=sr_i_272,,,
273. The Gospel According to André,2017,1h 33m,PG-13,6.8,866,,"This intimate portrait for André Leon Tally, a fixture in the world of fashion, takes viewers on a journey from André’s roots growing up to becoming one of the most influential tastemakers and fashion curators of our times.",https://www.imdb.com/title/tt7218804/?ref_=sr_i_273,,,
274. Leaning Into The Wind,2017,1h 37m,PG,7.0,489,,"Leaning into the Wind follows artist Andy Goldsworthy on his exploration of the world and himself through ephemeral and permanent workings on the landscape, cities and with his own body.",https://www.imdb.com/title/tt6263828/?ref_=sr_i_274,,,
275. Tom of Finland,2017,1h 57m,Not Rated,6.8,6.5K,,"Award-winning filmmaker Dome Karukoski brings to screen the life and work of artist Touko Valio Laaksonen (aka Tom of Finland), one of the most influential and celebrated figures of 20th-century gay culture.",https://www.imdb.com/title/tt5226984/?ref_=sr_i_275,,,
276. Rebel in the Rye,2017,1h 46m,PG-13,6.7,11K,,"The life of celebrated but reclusive author, J.D. Salinger, who gained worldwide fame with the publication of his novel, ""The Catcher in the Rye"".",https://www.imdb.com/title/tt4986134/?ref_=sr_i_276,,,
277. Oh Lucy!,2017,1h 35m,,6.8,3.4K,,"A lonely woman living in Tokyo decides to take an English class, where she discovers her alter-ego, Lucy.",https://www.imdb.com/title/tt6343058/?ref_=sr_i_277,,,
278. Grace Jones: Bloodlight and Bami,2017,1h 55m,,6.2,1.3K,,"Electrifying concert performances and intimate, personal footage showcase the life and talent of singer and actress Grace Jones.",https://www.imdb.com/title/tt6903636/?ref_=sr_i_278,,,
279. Kung Fu Yoga,2017,1h 47m,Not Rated,5.2,12K,,"Two professors team up to locate a lost treasure and embark on an adventure that takes them from a Tibetan ice cave to Dubai, and to a mountain temple in India.",https://www.imdb.com/title/tt4217392/?ref_=sr_i_279,,,
280. Murder in the Woods,2017,1h 28m,R,3.7,427,,"Soon after arriving to a mysterious cabin in the woods, a group of teens discover the dark secret it holds, which forces them to fight for their lives.",https://www.imdb.com/title/tt6083146/?ref_=sr_i_280,,,
281. Pearl Jam: Let's Play Two,2017,2h,Not Rated,8.3,760,,Concert film centering on the rock band Pearl Jam's August 2016 shows at Chicago's Wrigley Field.,https://www.imdb.com/title/tt7435110/?ref_=sr_i_281,,,
282. OK Jaanu,2017,2h 15m,Not Rated,5.3,5.1K,,"Adi and Tara move to Mumbai to pursue their dreams. A chance meeting sparks off a heady, no strings attached romance until their careers pull them apart. Will ambition prevail over matters of the heart?",https://www.imdb.com/title/tt5764024/?ref_=sr_i_282,,,
283. God's Own Country,2017,1h 44m,Not Rated,7.6,37K,,"Spring. Yorkshire. Young farmer Johnny Saxby numbs his daily frustrations with binge drinking and casual sex, until the arrival of a Romanian migrant worker for lambing season ignites an intense relationship that sets Johnny on a new path.",https://www.imdb.com/title/tt5635086/?ref_=sr_i_283,,,
284. This Is Not What I Expected,2017,1h 46m,TV-PG,6.7,1.9K,,"An obsessive CEO of a company meets a ragged chef by chance. They are drawn closer together because of their love for delicacies, yet their personalities clash big time.",https://www.imdb.com/title/tt6772874/?ref_=sr_i_284,,,
285. Shine,2017,1h 35m,R,4.6,253,,"Two Puerto Rican brothers from New York's Spanish Harlem and the street's best Salsa dancers, are separated after a tragedy only to reunite years later on opposing sides of gentrification.",https://www.imdb.com/title/tt4064912/?ref_=sr_i_285,,,
286. Flower,2017,1h 30m,R,6.0,11K,,A sexually curious teen forms an unorthodox kinship with her mentally unstable stepbrother.,https://www.imdb.com/title/tt2582784/?ref_=sr_i_286,,,
287. In the Fade,2017,1h 46m,R,7.1,36K,,"Katja's life collapses after the deaths of her husband and son in a bomb attack. After a time of mourning and injustice, Katja seeks revenge.",https://www.imdb.com/title/tt5723272/?ref_=sr_i_287,,,
