Title,Year,Duration,MPA,Rating,Votes,méta_score,description,Movie Link,writers,director,budget
1. Star Wars: Episode VIII - The Last Jedi,2017,2h 32m,PG-13,6.9,685K,,Rey develops her abilities with the help of Luke Skywalker as the Resistance prepares for battle against the First Order.,https://www.imdb.com/title/tt2527336/?ref_=sr_i_1,,,
2. Beauty and the Beast,2017,2h 9m,PG,7.1,341K,,"A brave, beautiful, and brilliant young woman is imprisoned by a beast in his castle. Despite her fears, she learns to see beyond the beast's hideous exterior and realize the gentle heart of the true prince within him.",https://www.imdb.com/title/tt2771200/?ref_=sr_i_2,,,
3. Wonder Woman,2017,2h 21m,PG-13,7.3,711K,,"When a pilot crashes and tells of conflict in the outside world, Diana, an Amazonian warrior in training, leaves home to fight a war, discovering her full powers and true destiny.",https://www.imdb.com/title/tt0451279/?ref_=sr_i_3,,,
4. Jumanji: Welcome to the Jungle,2017,1h 59m,PG-13,7.0,466K,,"Four teenagers are sucked into a magical video game, and the only way they can escape is to work together to finish the game.",https://www.imdb.com/title/tt2283362/?ref_=sr_i_4,,,
5. Guardians of the Galaxy Vol. 2,2017,2h 16m,PG-13,7.6,780K,,"The Guardians struggle to keep together as a team while dealing with their personal family issues, notably Star-Lord's encounter with his father, the ambitious celestial being Ego.",https://www.imdb.com/title/tt3896198/?ref_=sr_i_5,,,
6. Spider-Man: Homecoming,2017,2h 13m,PG-13,7.4,741K,,Peter Parker tries to stop Adrian 'The Vulture' Toomes from selling weapons made with advanced Chitauri technology while trying to balance his life as an ordinary high school student.,https://www.imdb.com/title/tt2250912/?ref_=sr_i_6,,,
7. It,2017,2h 15m,R,7.3,630K,,"In the summer of 1989, a group of bullied kids band together to destroy a shape-shifting monster, which disguises itself as a clown and preys on the children of Derry, their small Maine town.",https://www.imdb.com/title/tt1396484/?ref_=sr_i_7,,,
8. Thor: Ragnarok,2017,2h 10m,PG-13,7.9,839K,,"Imprisoned on the planet Sakaar, Thor must race against time to return to Asgard and stop Ragnarök, the destruction of his world, at the hands of the powerful and ruthless villain Hela.",https://www.imdb.com/title/tt3501632/?ref_=sr_i_8,,,
9. Despicable Me 3,2017,1h 29m,PG,6.3,164K,,"Gru meets his long-lost, charming, cheerful, and more successful twin brother Dru, who wants to team up with him for one last criminal heist.",https://www.imdb.com/title/tt3469046/?ref_=sr_i_9,,,
10. Justice League,2017,2h,PG-13,6.0,486K,,"Steppenwolf and his Parademons return after eons to capture Earth. However, Batman seeks the help of Wonder Woman to recruit and assemble Flash, Cyborg and Aquaman to fight the powerful new enemy.",https://www.imdb.com/title/tt0974015/?ref_=sr_i_10,,,
11. Logan,2017,2h 17m,R,8.1,871K,,"In a future where mutants are nearly extinct, an elderly and weary Logan leads a quiet life. But when Laura, a mutant child pursued by scientists, comes to him for help, he must get her to safety.",https://www.imdb.com/title/tt3315342/?ref_=sr_i_11,,,
12. The Fate of the Furious,2017,2h 16m,PG-13,6.6,260K,,"When a mysterious woman seduces Dominic Toretto into the world of terrorism and a betrayal of those closest to him, the crew face trials that will test them as never before.",https://www.imdb.com/title/tt4630562/?ref_=sr_i_12,,,
13. Coco,2017,1h 45m,PG,8.4,626K,,"Aspiring musician Miguel, confronted with his family's ancestral ban on music, enters the Land of the Dead to find his great-great-grandfather, a legendary singer.",https://www.imdb.com/title/tt2380307/?ref_=sr_i_13,,,
14. Dunkirk,2017,1h 46m,PG-13,7.8,759K,,"Allied soldiers from Belgium, the British Commonwealth and Empire, and France are surrounded by the German Army and evacuated during a fierce battle in World War II.",https://www.imdb.com/title/tt5013056/?ref_=sr_i_14,,,
15. Get Out,2017,1h 44m,R,7.8,739K,,"A young African-American visits his white girlfriend's parents for the weekend, where his simmering uneasiness about their reception of him eventually reaches a boiling point.",https://www.imdb.com/title/tt5052448/?ref_=sr_i_15,,,
16. The Lego Batman Movie,2017,1h 44m,PG,7.3,179K,,"A cooler-than-ever Bruce Wayne must deal with the usual suspects as they plan to rule Gotham City, while discovering that he has accidentally adopted a teenage orphan who wishes to become his sidekick.",https://www.imdb.com/title/tt4116284/?ref_=sr_i_16,,,
17. The Boss Baby,2017,1h 37m,PG,6.3,146K,,"A suit-wearing, briefcase-carrying baby pairs up with his 7-year old brother to stop the dastardly plot of the CEO of Puppy Co.",https://www.imdb.com/title/tt3874544/?ref_=sr_i_17,,,
18. The Greatest Showman,2017,1h 45m,PG,7.5,323K,,Celebrates the birth of show business and tells of a visionary who rose from nothing to create a spectacle that became a worldwide sensation.,https://www.imdb.com/title/tt1485796/?ref_=sr_i_18,,,
19. Pirates of the Caribbean: Dead Men Tell No Tales,2017,2h 9m,PG-13,6.5,357K,,Captain Jack Sparrow searches for the Trident of Poseidon to rule the sea while being pursued by old rival Captain Salazar and a crew of deadly ghosts who have escaped from the Devil's Triangle.,https://www.imdb.com/title/tt1790809/?ref_=sr_i_19,,,
20. Kong: Skull Island,2017,1h 58m,PG-13,6.7,358K,,"After the Vietnam war, a team of scientists explores an uncharted island in the Pacific, venturing into the domain of the mighty Kong and must fight to escape a primal Eden.",https://www.imdb.com/title/tt3731562/?ref_=sr_i_20,,,
21. Cars 3,2017,1h 42m,G,6.7,130K,,Lightning McQueen sets out to prove to a new generation of racers that he's still the best race car in the world.,https://www.imdb.com/title/tt3606752/?ref_=sr_i_21,,,
22. War for the Planet of the Apes,2017,2h 20m,PG-13,7.4,310K,,"After the apes suffer unimaginable losses, Caesar wrestles with his darker instincts and begins his own mythic quest to avenge his kind.",https://www.imdb.com/title/tt3450958/?ref_=sr_i_22,,,
23. Wonder,2017,1h 53m,PG,7.9,185K,,"Based on the New York Times bestseller, this movie tells the incredibly inspiring and heartwarming story of August Pullman, a boy with facial differences who enters the fifth grade, attending a mainstream elementary school for the first time.",https://www.imdb.com/title/tt2543472/?ref_=sr_i_23,,,
24. Transformers: The Last Knight,2017,2h 34m,PG-13,5.2,174K,,"A deadly threat from Earth's history reappears and a hunt for a lost artifact takes place between Autobots and Decepticons, while Optimus Prime encounters his creator in space.",https://www.imdb.com/title/tt3371366/?ref_=sr_i_24,,,
25. Girls Trip,2017,2h 2m,R,6.2,41K,,"When four lifelong friends travel to New Orleans for the annual Essence Festival, sisterhoods are rekindled, wild sides are rediscovered, and there's enough dancing, drinking, brawling and romancing to make the Big Easy blush.",https://www.imdb.com/title/tt3564472/?ref_=sr_i_25,,,
26. Fifty Shades Darker,2017,1h 58m,R,4.6,115K,,"While Christian wrestles with his inner demons, Anastasia must confront the anger and envy of the women who came before her.",https://www.imdb.com/title/tt4465564/?ref_=sr_i_26,,,
27. The Upside,2017,2h 6m,PG-13,7.0,65K,,A comedic look at the relationship between a wealthy man with quadriplegia and an unemployed man with a criminal record who's hired to help him.,https://www.imdb.com/title/tt1987680/?ref_=sr_i_27,,,
28. Baby Driver,2017,1h 53m,R,7.5,634K,,"Coerced into working for a crime boss, a young getaway driver must face the music when a doomed heist threatens his life, love, and freedom.",https://www.imdb.com/title/tt3890160/?ref_=sr_i_28,,,
29. Pitch Perfect 3,2017,1h 33m,PG-13,5.8,74K,,"Following their win at the world championship, the now separated Bellas reunite for one last singing competition at an overseas USO tour, but face a group who uses both instruments and voices.",https://www.imdb.com/title/tt4765284/?ref_=sr_i_29,,,
30. Daddy's Home 2,2017,1h 40m,PG-13,6.0,85K,,"Having finally gotten used to each other's existence, Brad and Dusty must now deal with their intrusive fathers during the holidays.",https://www.imdb.com/title/tt5657846/?ref_=sr_i_30,,,
31. Murder on the Orient Express,2017,1h 54m,PG-13,6.5,305K,,"When a murder occurs on the train on which he's travelling, celebrated detective Hercule Poirot is recruited to solve the case.",https://www.imdb.com/title/tt3402236/?ref_=sr_i_31,,,
32. Annabelle: Creation,2017,1h 49m,R,6.5,156K,,"Twelve years after the tragic death of their little girl, a doll-maker and his wife welcome a nun and several girls from a shuttered orphanage into their home, where they become the target of the doll-maker's possessed creation, Annabelle.",https://www.imdb.com/title/tt5140878/?ref_=sr_i_32,,,
33. Kingsman: The Golden Circle,2017,2h 21m,R,6.7,376K,,"After the Kingsman's headquarters is destroyed and the world is held hostage, an allied spy organization in the United States is discovered. These two elite secret agencies must band together to defeat a common enemy.",https://www.imdb.com/title/tt4649466/?ref_=sr_i_33,,,
34. Blade Runner 2049,2017,2h 44m,R,8.0,693K,,"Young Blade Runner K's discovery of a long-buried secret leads him to track down former Blade Runner Rick Deckard, who's been missing for thirty years.",https://www.imdb.com/title/tt1856101/?ref_=sr_i_34,,,
35. John Wick: Chapter 2,2017,2h 2m,R,7.4,528K,,"After returning to the criminal underworld to repay a debt, John Wick discovers that a large bounty has been put on his life.",https://www.imdb.com/title/tt4425200/?ref_=sr_i_35,,,
36. The Emoji Movie,2017,1h 26m,PG,3.4,74K,,"Gene, a multi-expressional emoji, sets out on a journey to become a normal emoji.",https://www.imdb.com/title/tt4877122/?ref_=sr_i_36,,,
37. Power Rangers,2017,2h 4m,PG-13,5.9,116K,,"When Earth is on the verge of an alien invasion, five teenagers, who are infused with superhuman abilities, must harness their newfound powers to battle this threat - as the Power Rangers.",https://www.imdb.com/title/tt3717490/?ref_=sr_i_37,,,
38. Ferdinand,2017,1h 48m,PG,6.7,66K,,"After Ferdinand, a bull with a big heart, is mistaken for a dangerous beast, he is captured and torn from his home. Determined to return to his family, he rallies a misfit team on the ultimate adventure.",https://www.imdb.com/title/tt3411444/?ref_=sr_i_38,,,
39. The Post,2017,1h 56m,PG-13,7.2,165K,,A cover-up spanning four U.S. Presidents pushes the country's first female newspaper publisher and her editor to join an unprecedented battle between press and government.,https://www.imdb.com/title/tt6294822/?ref_=sr_i_39,,,
40. The Mummy,2017,1h 50m,PG-13,5.4,211K,,"An ancient Egyptian princess is awakened from her crypt beneath the desert, bringing with her malevolence grown over millennia and terrors that defy human comprehension.",https://www.imdb.com/title/tt2345759/?ref_=sr_i_40,,,
41. The Hitman's Bodyguard,2017,1h 58m,R,6.9,253K,,"Michael Bryce, a protection agent, is tasked with protecting Darius Kincaid, one of the world's most famous assassins.",https://www.imdb.com/title/tt1959563/?ref_=sr_i_41,,,
42. Alien: Covenant,2017,2h 2m,R,6.4,324K,,"The crew of a colony ship, bound for a remote planet, discover an uncharted paradise with a threat beyond their imagination, and must attempt a harrowing escape.",https://www.imdb.com/title/tt2316204/?ref_=sr_i_42,,,
43. Captain Underpants: The First Epic Movie,2017,1h 29m,PG,6.2,34K,,"Two overly-imaginative pranksters hypnotize their grumpy principal into thinking he's a ridiculously enthusiastic, incredibly dimwitted, underwear-themed superhero.",https://www.imdb.com/title/tt2091256/?ref_=sr_i_43,,,
44. A Bad Moms Christmas,2017,1h 44m,R,5.6,59K,,"As their own mothers drop in unexpectedly, our three under-appreciated and over-burdened moms rebel against the challenges and expectations of the Super Bowl for mothers: Christmas.",https://www.imdb.com/title/tt6359956/?ref_=sr_i_44,,,
45. A Dog's Purpose,2017,1h 40m,PG,7.2,81K,,"A dog discovers the meaning of its own existence through the lives of the humans it teaches to laugh and love. Reincarnated as multiple canines over the course of five decades, the lovable pooch develops an unbreakable bond with Ethan.",https://www.imdb.com/title/tt1753383/?ref_=sr_i_45,,,
46. The Shape of Water,2017,2h 3m,R,7.3,455K,,"At a top secret research facility in the 1960s, a lonely janitor forms a unique relationship with an amphibious creature that is being held in captivity.",https://www.imdb.com/title/tt5580390/?ref_=sr_i_46,,,
47. The Lego Ninjago Movie,2017,1h 41m,PG,6.0,31K,,"Shunned by everyone for being the son of an evil warlord, a teenager seeks to defeat him with the help of his fellow ninjas.",https://www.imdb.com/title/tt3014284/?ref_=sr_i_47,,,
48. Baywatch,2017,1h 56m,R,5.5,207K,,"Devoted lifeguard Mitch Buchannon butts heads with a brash new recruit, as they uncover a criminal plot that threatens the future of the bay.",https://www.imdb.com/title/tt1469304/?ref_=sr_i_48,,,
49. The Shack,2017,2h 12m,PG-13,6.3,40K,,"A grieving man receives a mysterious, personal invitation to meet with God at a place called ""The Shack.""",https://www.imdb.com/title/tt2872518/?ref_=sr_i_49,,,
50. Darkest Hour,2017,2h 5m,PG-13,7.4,227K,,"In May 1940, the fate of World War II hangs on Winston Churchill, who must decide whether to negotiate with Adolf Hitler, or fight on knowing that it could mean the end of the British Empire.",https://www.imdb.com/title/tt4555426/?ref_=sr_i_50,,,
51. Happy Death Day,2017,1h 36m,PG-13,6.6,172K,,"A college student must relive the day of her murder over and over again, in a loop that will end only when she discovers her killer's identity.",https://www.imdb.com/title/tt5308322/?ref_=sr_i_51,,,
"52. Three Billboards Outside Ebbing, Missouri",2017,1h 55m,R,8.1,570K,,A mother personally challenges the local authorities to solve her daughter's murder when they fail to catch the culprit.,https://www.imdb.com/title/tt5027774/?ref_=sr_i_52,,,
53. Atomic Blonde,2017,1h 55m,R,6.7,212K,,An undercover MI6 agent is sent to Berlin during the Cold War to investigate the murder of a fellow agent and recover a missing list of double agents.,https://www.imdb.com/title/tt2406566/?ref_=sr_i_53,,,
54. American Made,2017,1h 55m,R,7.1,215K,,"The story of Barry Seal, an American pilot who became a drug-runner for the CIA in the 1980s in a clandestine operation that would be exposed as the Iran-Contra Affair.",https://www.imdb.com/title/tt3532216/?ref_=sr_i_54,,,
55. Jai Lava Kusa,2017,2h 30m,Not Rated,6.8,6.8K,,"Sidelined at a very young age due to stammering, the eldest of identical triplets develops hatred for his younger brothers and creates havoc in their lives as they all reunite as adults.",https://www.imdb.com/title/tt6861726/?ref_=sr_i_55,,,
56. The Dark Tower,2017,1h 35m,PG-13,5.6,149K,,A boy haunted by visions of a dark tower from a parallel reality teams up with the tower's disillusioned guardian to stop an evil warlock known as the Man in Black who plans to use the boy to destroy the tower and open the gates of Hell.,https://www.imdb.com/title/tt1648190/?ref_=sr_i_56,,,
57. Lady Bird,2017,1h 34m,R,7.4,344K,,"A fiercely independent teenager tries to make her own way in the world while wanting to get out of her hometown of Sacramento, California and to get away from her complicated mother and recently-unemployed father.",https://www.imdb.com/title/tt4925292/?ref_=sr_i_57,,,
58. Boo 2! A Madea Halloween,2017,1h 41m,PG-13,4.0,5.4K,,"Madea, Bam, and Hattie venture to a haunted campground and the group must run for their lives when monsters, goblins, and the boogeyman are unleashed.",https://www.imdb.com/title/tt6217804/?ref_=sr_i_58,,,
59. Snatched,2017,1h 30m,R,4.7,38K,,"When her boyfriend dumps her before their exotic vacation, a young woman persuades her ultra-cautious mother to travel with her to paradise, with unexpected results.",https://www.imdb.com/title/tt2334871/?ref_=sr_i_59,,,
60. Smurfs: The Lost Village,2017,1h 30m,PG,6.0,25K,,"A mysterious map sets Smurfette and her friends Brainy, Clumsy and Hefty on an exciting race through the Forbidden Forest, leading to the discovery of the biggest secret in Smurf history.",https://www.imdb.com/title/tt2398241/?ref_=sr_i_60,,,
61. Going in Style,2017,1h 36m,PG-13,6.6,94K,,"Desperate to pay their bills and support their loved ones, lifelong pals Willy Davis, Albert Gardner, and Joe Harding risk it all by robbing the bank that absconded with the pension money that they earned from working there for years.",https://www.imdb.com/title/tt2568862/?ref_=sr_i_61,,,
62. All Eyez on Me,2017,2h 19m,R,5.9,25K,,"Tells the true and untold story of prolific rapper, actor, poet and activist Tupac Shakur.",https://www.imdb.com/title/tt1666185/?ref_=sr_i_62,,,
63. xXx: Return of Xander Cage,2017,1h 47m,PG-13,5.2,99K,,"Xander Cage is left for dead after an incident, though he secretly returns to action for a new, tough assignment with his handler Augustus Gibbons.",https://www.imdb.com/title/tt1293847/?ref_=sr_i_63,,,
64. 47 Meters Down,2017,1h 29m,PG-13,5.6,62K,,"Two sisters vacationing in Mexico are trapped in a shark cage at the bottom of the ocean. With less than an hour of oxygen left and great white sharks circling nearby, they must fight to survive.",https://www.imdb.com/title/tt2932536/?ref_=sr_i_64,,,
65. The Big Sick,2017,2h,R,7.5,146K,,"Pakistan-born comedian Kumail Nanjiani and grad student Emily Gardner fall in love but struggle as their cultures clash. When Emily contracts a mysterious illness, Kumail finds himself forced to face her feisty parents, his family's expectations, and his true feelings.",https://www.imdb.com/title/tt5462602/?ref_=sr_i_65,,,
66. Valerian and the City of a Thousand Planets,2017,2h 16m,PG-13,6.4,201K,,"A dark force threatens Alpha, a vast metropolis and home to species from a thousand planets. Special operatives Valerian and Laureline must race to identify the marauding menace and safeguard not just Alpha, but the future of the universe.",https://www.imdb.com/title/tt2239822/?ref_=sr_i_66,,,
67. The Star,2017,1h 26m,PG,6.3,9.6K,,A small but brave donkey and his animal friends become the unsung heroes of the first Christmas.,https://www.imdb.com/title/tt4587656/?ref_=sr_i_67,,,
68. Ghost in the Shell,2017,1h 47m,PG-13,6.3,231K,,"In the near future, Major Mira Killian is the first of her kind: A human saved from a terrible crash, who is cyber-enhanced to be a perfect soldier devoted to stopping the world's most dangerous criminals.",https://www.imdb.com/title/tt1219827/?ref_=sr_i_68,,,
69. Paddington 2,2017,1h 43m,PG,7.8,99K,,"Paddington, now happily settled with the Brown family and a popular member of the local community, picks up a series of odd jobs to buy the perfect present for his Aunt Lucy's 100th birthday, only for the gift to be stolen.",https://www.imdb.com/title/tt4468740/?ref_=sr_i_69,,,
70. King Arthur: Legend of the Sword,2017,2h 6m,PG-13,6.7,237K,,"Robbed of his birthright, Arthur comes up the hard way in the back alleys of the city. But once he pulls the sword from the stone, he is forced to acknowledge his true legacy - whether he likes it or not.",https://www.imdb.com/title/tt1972591/?ref_=sr_i_70,,,
71. Jigsaw,2017,1h 32m,R,5.7,96K,,Police search for a supposed to be dead killer who forces his victims to play sadistic games of life and death.,https://www.imdb.com/title/tt3348730/?ref_=sr_i_71,,,
72. American Assassin,2017,1h 51m,R,6.2,94K,,"After the death of his girlfriend at the hands of terrorists, Mitch Rapp is drawn into the world of counterterrorism, mentored by tough-as-nails former U.S. Navy S.E.A.L. Stan Hurley.",https://www.imdb.com/title/tt1961175/?ref_=sr_i_72,,,
73. The Foreigner,2017,1h 53m,R,7.0,126K,,"A humble businessman with a buried past seeks justice when his daughter is killed in an act of terrorism. A cat-and-mouse conflict ensues with a government official, whose past may hold clues to the killers' identities.",https://www.imdb.com/title/tt1615160/?ref_=sr_i_73,,,
"74. Everything, Everything",2017,1h 36m,PG-13,6.3,43K,,A teenager who's spent her whole life confined to her home falls for the boy next door.,https://www.imdb.com/title/tt5001718/?ref_=sr_i_74,,,
75. Wind River,2017,1h 47m,R,7.7,289K,,"A wildlife officer, who is haunted by a tragedy that happened because of him, teams up with an FBI agent in solving a murder of a young woman on a Wyoming Native American reservation and hopes to get redemption from his past regrets.",https://www.imdb.com/title/tt5362988/?ref_=sr_i_75,,,
76. Geostorm,2017,1h 51m,PG-13,5.3,123K,,"When the network of satellites designed to control the global climate starts to attack Earth, it's a race against the clock for its creator to uncover the real threat before a worldwide Geostorm wipes out everything and everyone.",https://www.imdb.com/title/tt1981128/?ref_=sr_i_76,,,
77. Fist Fight,2017,1h 31m,R,5.6,47K,,"When one school teacher unwittingly causes another teacher's dismissal, he is challenged to an after-school fight.",https://www.imdb.com/title/tt3401882/?ref_=sr_i_77,,,
78. How to Be a Latin Lover,2017,1h 55m,PG-13,6.0,18K,,"Finding himself dumped after twenty-five years of marriage, a man who made a career of seducing rich older women must move in with his estranged sister, where he begins to learn the value of family.",https://www.imdb.com/title/tt4795124/?ref_=sr_i_78,,,
79. Kidnap,2017,1h 35m,R,5.9,40K,,A mother stops at nothing to recover her kidnapped son.,https://www.imdb.com/title/tt1458169/?ref_=sr_i_79,,,
80. The Mountain Between Us,2017,1h 52m,PG-13,6.4,82K,,"Stranded after a tragic plane crash, two strangers must forge a connection to survive the extreme elements of a remote snow-covered mountain. When they realize help is not coming, they embark on a perilous journey across the wilderness.",https://www.imdb.com/title/tt2226597/?ref_=sr_i_80,,,
81. Life,2017,1h 44m,R,6.6,263K,,A team of scientists aboard the International Space Station discover a rapidly evolving life form that caused extinction on Mars and now threatens all life on Earth.,https://www.imdb.com/title/tt5442430/?ref_=sr_i_81,,,
"82. I, Tonya",2017,1h 59m,R,7.5,249K,,"Competitive ice skater Tonya Harding rises amongst the ranks at the U.S. Figure Skating Championships, but her future in the activity is thrown into doubt when her ex-husband intervenes.",https://www.imdb.com/title/tt5580036/?ref_=sr_i_82,,,
83. Hostiles,2017,2h 14m,R,7.2,99K,,"In 1892, a legendary Army Captain reluctantly agrees to escort a Cheyenne chief and his family through dangerous territory.",https://www.imdb.com/title/tt5478478/?ref_=sr_i_83,,,
84. Molly's Game,2017,2h 20m,R,7.4,193K,,"The true story of Molly Bloom, an Olympic-class skier who ran the world's most exclusive high-stakes poker game and became an FBI target.",https://www.imdb.com/title/tt4209788/?ref_=sr_i_84,,,
85. The Nut Job 2: Nutty by Nature,2017,1h 31m,PG,5.5,7.5K,,A group of squirrels try to stop a mayor from destroying the park where they live to make way for a dysfunctional amusement park.,https://www.imdb.com/title/tt3486626/?ref_=sr_i_85,,,
86. Rings,2017,1h 42m,PG-13,4.5,44K,,A young woman finds herself on the receiving end of a terrifying curse that threatens to take her life in 7 days.,https://www.imdb.com/title/tt0498381/?ref_=sr_i_86,,,
87. Logan Lucky,2017,1h 58m,PG-13,7.0,168K,,Two brothers attempt to pull off a heist during a NASCAR race in North Carolina.,https://www.imdb.com/title/tt5439796/?ref_=sr_i_87,,,
88. Home Again,2017,1h 37m,PG-13,5.8,36K,,Life for a single mom in Los Angeles takes an unexpected turn when she allows three young men to move in with her.,https://www.imdb.com/title/tt5719700/?ref_=sr_i_88,,,
89. The House,2017,1h 28m,R,5.6,48K,,"After the town takes away their daughter's college scholarship, a couple start an illegal casino in their friend's house to make back the money.",https://www.imdb.com/title/tt4481514/?ref_=sr_i_89,,,
90. All the Money in the World,2017,2h 12m,R,6.8,93K,,The story of the kidnapping of 16-year-old John Paul Getty III and the desperate attempt by his devoted mother to convince his billionaire grandfather Jean Paul Getty to pay the ransom.,https://www.imdb.com/title/tt5294550/?ref_=sr_i_90,,,
91. Gifted,2017,1h 41m,PG-13,7.6,144K,,"Frank, a single man raising his child prodigy niece Mary, is drawn into a custody battle with his mother.",https://www.imdb.com/title/tt4481414/?ref_=sr_i_91,,,
92. Downsizing,2017,2h 15m,R,5.8,129K,,"A social satire in which a man realizes he would have a better life if he were to shrink himself to five inches tall, allowing him to live in wealth and splendor.",https://www.imdb.com/title/tt1389072/?ref_=sr_i_92,,,
93. The Bye Bye Man,2017,1h 36m,PG-13,4.3,27K,,Three friends stumble upon the horrific origins of a mysterious figure they discover is the root cause of the evil behind unspeakable acts.,https://www.imdb.com/title/tt4030600/?ref_=sr_i_93,,,
94. Victoria & Abdul,2017,1h 51m,PG-13,6.8,39K,,Queen Victoria strikes up an unlikely friendship with a young Indian clerk named Abdul Karim.,https://www.imdb.com/title/tt5816682/?ref_=sr_i_94,,,
95. Rough Night,2017,1h 41m,R,5.2,57K,,Things go terribly wrong for a group of girlfriends who hire a male stripper for a bachelorette party in Miami.,https://www.imdb.com/title/tt4799050/?ref_=sr_i_95,,,
96. My Little Pony: The Movie,2017,1h 39m,PG,6.1,8.3K,,"After a dark force conquers Canterlot, the Mane 6 embark on an unforgettable journey beyond Equestria where they meet new friends and exciting challenges on a quest to use the magic of friendship to save their homeland.",https://www.imdb.com/title/tt4131800/?ref_=sr_i_96,,,
