Title,Year,Duration,MPA,Rating,Votes,méta_score,description,Movie Link,writers,director,budget
382. How to Talk to Girls at Parties,2017,1h 42m,R,5.7,13K,,An alien touring the galaxy breaks away from her group and meets two young inhabitants of the most dangerous place in the universe: the London borough of Croydon.,https://www.imdb.com/title/tt3859310/?ref_=sr_i_382,,,
383. Heal,2017,1h 46m,Not Rated,7.0,3K,,"A documentary film that takes us on a scientific and spiritual journey where we discover that by changing one's perceptions, the human body can heal itself from any dis-ease.",https://www.imdb.com/title/tt5239942/?ref_=sr_i_383,,,
384. Custody,2017,1h 33m,,7.5,11K,,A broken marriage leads to a bitter custody battle with an embattled son at the centre.,https://www.imdb.com/title/tt6002232/?ref_=sr_i_384,,,
385. Claire's Camera,2017,1h 9m,Unrated,6.4,2.7K,,"The story of female friendship as Frenchwoman Claire helps the subject of her photograph, Min-Hee, discover why she was fired without apparent cause.",https://www.imdb.com/title/tt5989220/?ref_=sr_i_385,,,
386. Godard Mon Amour,2017,1h 47m,R,6.6,6.1K,,"In 1967, during the making of ""La Chinoise,"" film director Jean-Luc Godard falls in love with 19-year-old actress Anne Wiazemsky and marries her.",https://www.imdb.com/title/tt5687334/?ref_=sr_i_386,,,
387. Earth: One Amazing Day,2017,1h 35m,G,7.8,3.2K,,"From BBC Earth Films, the studio that brought you Earth, comes the sequel - Earth: One Amazing Day, an astonishing journey revealing the awesome power of the natural world. Over the course of one single day, we track the sun from the highest mountains to the remotest islands to exotic jungles. Breakthroughs in filmmaking technology bring you up close with a cast of unforgettable characters. Told with humour, intimacy and a jaw-dropping sense of cinematic splendour, Earth: One Amazing Day highlights how every day is filled with more wonders than you can possibly imagine- until now.",https://www.imdb.com/title/tt6238896/?ref_=sr_i_387,,,
388. The Nile Hilton Incident,2017,1h 51m,Unrated,6.8,9.5K,,"A maid witnesses a murder at an upscale hotel and a policeman is assigned to the case, but it soon becomes clear that important people don't want the case solved.",https://www.imdb.com/title/tt5540188/?ref_=sr_i_388,,,
389. En el séptimo día,2017,1h 32m,TV-14,7.1,322,,"A group of undocumented Mexican immigrants work long hours six days a week, and then savor their day of rest on Sundays on the soccer fields of Brooklyn.",https://www.imdb.com/title/tt6144092/?ref_=sr_i_389,,,
390. Have a Nice Day,2017,1h 17m,,6.5,2.3K,,A city in southern China and a bag containing a million yuan draw several people from diverse backgrounds with different personal motives into a bloody conflict.,https://www.imdb.com/title/tt6451304/?ref_=sr_i_390,,,
391. The Portrait,2017,2h 4m,TV-PG,7.1,157,,"In a musical tale about standing together against materialism, two impoverished sisters anguish over whether or not to sell a painting, the final masterpiece by their recluse father. A bitter struggle for survival against betrayal set in pre-World War II Manila.",https://www.imdb.com/title/tt6099554/?ref_=sr_i_391,,,
392. Shock and Awe,2017,1h 30m,R,6.4,9K,,"A group of journalists of the Knight-Ridder news service covering President George W. Bush's planned invasion of Iraq in 2003 are skeptical of the President's claim that Saddam Hussein has ""weapons of mass destruction.""",https://www.imdb.com/title/tt5540992/?ref_=sr_i_392,,,
393. Pop Aye,2017,1h 44m,,6.6,1.1K,,"On a chance encounter, a disenchanted architect bumps into his long-lost elephant on the streets of Bangkok. Excited, he takes his elephant on a journey across Thailand, in search of the farm where they grew up together.",https://www.imdb.com/title/tt3740066/?ref_=sr_i_393,,,
394. The Divine Order,2017,1h 36m,,7.1,3.1K,,"In 1971, a young housewife organizes the women of her town to petition for the right to vote.",https://www.imdb.com/title/tt5818818/?ref_=sr_i_394,,,
395. The Brawler,2017,2h 34m,Not Rated,8.0,8.8K,,A boxer struggles to make his mark in the boxing world.,https://www.imdb.com/title/tt7180544/?ref_=sr_i_395,,,
396. Warriors of the Dawn,2017,2h 10m,,6.3,498,,A crown prince emerges as a leader during the war between Korea and Japan in 1592.,https://www.imdb.com/title/tt6010020/?ref_=sr_i_396,,,
397. Bill Nye: Science Guy,2017,1h 41m,Not Rated,6.8,1.3K,,A famous television personality struggles to restore science to its rightful place in a world hostile to evidence and reason.,https://www.imdb.com/title/tt4853154/?ref_=sr_i_397,,,
398. Tehran Taboo,2017,1h 36m,Not Rated,7.1,5.1K,,"In their desperate search for freedom and happiness, four young people from Tehran, Iran are forced to break the taboos of a restrictive, islamic society.",https://www.imdb.com/title/tt5584796/?ref_=sr_i_398,,,
399. Five Seasons: The Gardens of Piet Oudolf,2017,1h 15m,,7.8,103,,"Director Thomas Piper filmed the garden designer Piet Oudolf over five seasons as he designed gardens from New York's High Line and Hauser and Wirth's prairie garden in Somerset, England to his own private garden at Hummelo in Holland.",https://www.imdb.com/title/tt8306634/?ref_=sr_i_399,,,
400. After Auschwitz,2017,1h 23m,,7.3,138,,"""You're free. Go home"" Most Holocaust films end with these words, the very words that survivors heard at liberation. After Auschwitz begins with these words, inviting audiences to experience what happened next. For survivors, liberation from the camps was the beginning of a life long struggle. They wanted to go home, but there was no home left in Europe. They came to America and wanted to tell people about their pasts but were silenced for over three decades. ""You're in America now, put it behind you"". After Auschwitz is a ""Post-Holocaust"" documentary that captures what it means to survive and try to life a normal life after unspeakable tragedy. Six extraordinary women who all survived Auschwitz take us on a journey that American audiences have never seen before. These women all moved to Los Angeles, married, raised children and became ""Americans"" but they never truly found a place to call home. What makes the story so much more fascinating is how these women saw, interpreted and interacted with the changing face of America in the second half of the 20th century. They serve as our guides on an unbelievable journey, sometimes celebratory, sometimes heart breaking but always inspiring. It is also the only ""Holocaust"" film that includes Ricardo Montalban, George W. Bush and an appearance at The Kennedy Center Honors. After Auschwitz gives us the story that we have always wanted to see and one that in many ways is as important as the stories of the camps themselves.",https://www.imdb.com/title/tt6079976/?ref_=sr_i_400,,,
401. Bye Bye Germany,2017,1h 42m,,6.5,1.8K,,"David Berman and his friends, all Holocaust survivors, have only one purpose: to go to America as soon as possible. For this they need money. Close to his aim, David is not only deprived of his savings but also overtaken by his shady past.",https://www.imdb.com/title/tt5609734/?ref_=sr_i_401,,,
402. The Last Suit,2017,1h 31m,TV-14,7.1,985,,"Abraham Bursztein, an 88 year-old Jewish tailor, runs away from Buenos Aires to Poland, where he proposes to find a friend who saved him from certain death at the end of World War II. After seven decades without any contact with him, Abraham will try to find his old friend and keep his promise to return one day.",https://www.imdb.com/title/tt5991974/?ref_=sr_i_402,,,
"403. Nico, 1988",2017,1h 33m,R,6.7,2.1K,,"The last year of singer Nico's life, as she tours and grapples with addiction and personal demons.",https://www.imdb.com/title/tt7186092/?ref_=sr_i_403,,,
404. Namiya,2017,1h 56m,PG-13,5.1,691,,"When three runaways shack up in an abandoned general store, a supernatural correspondence connects them to many lives that were all touched by the owner of the store years before they were born.",https://www.imdb.com/title/tt7645502/?ref_=sr_i_404,,,
405. Turn It Around: The Story of East Bay Punk,2017,2h 35m,,7.8,352,,A documentary spanning over 30 years of the California Bay Area's punk music history with a central focus on the emergence of Berkeley's inspiring 924 Gilman Street music collective.,https://www.imdb.com/title/tt3913194/?ref_=sr_i_405,,,
406. Outside In,2017,1h 49m,Not Rated,6.7,6.4K,,An ex-con struggling to readjust to life in his small town forms an intense bond with his former high school teacher.,https://www.imdb.com/title/tt7260048/?ref_=sr_i_406,,,
407. The Ghost Bride,2017,1h 51m,,5.4,201,,"After receiving an unusual business proposal, a young woman experiences strange phenomena.",https://www.imdb.com/title/tt7582830/?ref_=sr_i_407,,,
408. Under the Tree,2017,1h 29m,Not Rated,6.8,5.6K,,"When Baldwin and Inga's next door neighbours complain that a tree in their backyard casts a shadow over their sundeck, what starts off as a typical spat between neighbours in the suburbs unexpectedly and violently spirals out of control.",https://www.imdb.com/title/tt6223806/?ref_=sr_i_408,,,
409. Arrangiarsi: pizza... and the art of living,2017,1h 31m,,7.9,129,,"When Matteo's life falls apart, he moves into a 1985 VW van, traces his roots to Naples, birthplace of pizza, and discovers ""arrangiarsi,"" the art of making something from nothing. He realizes he's not only ""living the film,"" but needs to master arrangiarsi to survive.",https://www.imdb.com/title/tt6097926/?ref_=sr_i_409,,,
410. Architects of Denial,2017,1h 42m,,7.8,259,,"Featuring Julian Assange, George Clooney, and brutal witness accounts, this film explores the controversy surrounding the Armenian genocide and persecution of Middle Eastern Christians, including the U.S. politicians who deny it occurred.",https://www.imdb.com/title/tt6842752/?ref_=sr_i_410,,,
411. Elizabeth Blue,2017,1h 35m,PG-13,5.3,162,,"A young woman, recently released from a mental hospital, is coping with ongoing episodes of schizophrenia.",https://www.imdb.com/title/tt5881892/?ref_=sr_i_411,,,
412. Beuys,2017,1h 47m,,6.8,516,,A documentary about the 20th century German sculptor and performance artist Joseph Beuys.,https://www.imdb.com/title/tt6340090/?ref_=sr_i_412,,,
413. Tragedy Girls,2017,1h 38m,R,6.0,12K,,"A twist on the slasher genre, following two death-obsessed teenage girls who use their online show about real-life tragedies to send their small mid-western town into a frenzy, and cement their legacy as modern horror legends.",https://www.imdb.com/title/tt3859272/?ref_=sr_i_413,,,
414. Manolo: The Boy Who Made Shoes for Lizards,2017,1h 29m,Not Rated,6.4,579,,"An in-depth portrait of MANOLO BLAHNIK, self-confessed 'cobbler' and the man regarded by most influential fashion figures as 'the best shoe-maker of the 20th and 21st centuries. A film for anyone who has ever looked longingly at a pair of... 'Manolos'",https://www.imdb.com/title/tt5821256/?ref_=sr_i_414,,,
415. The Force,2017,1h 32m,,6.8,740,,THE FORCE goes inside an embattled urban police department struggling to rebuild trust in one of America's most violent yet promising cities.,https://www.imdb.com/title/tt6159518/?ref_=sr_i_415,,,
416. Where Is Kyra?,2017,1h 38m,R,5.5,1.9K,,"In Brooklyn, New York, Kyra (Michelle Pfeiffer) loses her job and struggles to survive on her ailing mother's income. As the weeks and months go on, her problems worsen. This leads her on a risky and enigmatic path that threatens her life.",https://www.imdb.com/title/tt5198670/?ref_=sr_i_416,,,
417. Bomb City,2017,1h 38m,TV-MA,6.8,8.7K,,"Bomb City is a crime-thriller, about the cultural aversion of a group of punk rockers in a conservative Texas town. Their ongoing battle with a rival, more-affluent clique leads to a controversial hate crime that questions the morality of American justice. Based on the true-life story of Brian Deneke.",https://www.imdb.com/title/tt4351548/?ref_=sr_i_417,,,
418. Digimon Adventure tri. Part 4: Loss,2017,1h 22m,TV-PG,7.0,1.1K,,"Upon arriving at the Digital World after the ""reboot"", the digidestined are hunted by a new villain. Meanwhile, Sora is troubled by her partner digimon's indifference towards her.",https://www.imdb.com/title/tt5468016/?ref_=sr_i_418,,,
419. Woman Walks Ahead,2017,1h 41m,R,6.7,8.7K,,"Catherine Weldon, a portrait painter from 1890s Brooklyn, travels to Dakota to paint a portrait of Sitting Bull and becomes embroiled in the Lakota peoples' struggle over the rights to their land.",https://www.imdb.com/title/tt5436228/?ref_=sr_i_419,,,
420. Ramen Heads,2017,1h 33m,Not Rated,7.0,728,,"In 'Ramen Heads,' Osamu Tomita, Japan's reigning king of ramen, takes us deep into his world, revealing every single step of his obsessive approach to creating the perfect soup and noodles, and his relentless search for the highest-quality ingredients. In addition to Tomita's story, the film also profiles five other notable ramen shops, each with its own philosophy and flavour, which exemplify various different aspects the ramen world. Mixing in a brief rundown of ramen's historical roots, the film gives viewers an in-depth look at the culture surrounding this unique and beguiling dish. This is a documentary record of 15 months in the lives of Japan's top ramen masters and their legions of devoted fans.",https://www.imdb.com/title/tt6764122/?ref_=sr_i_420,,,
421. The Paris Opera,2017,1h 50m,,7.0,276,,"A behind-the-scenes look at the Paris Opera, under the direction of Stephane Lissner.",https://www.imdb.com/title/tt6599064/?ref_=sr_i_421,,,
422. Paw Patrol: Mission Big Screen,2017,1h 5m,,8.0,60,,"There's no screen too big and no pup too small in this 'Pawsome' cinema experience. Join Ryder, Chase, Marshall, Skye and the rest of the PAW Patrol as they take on em'bark' on adventures in Adventure Bay and beyond.",https://www.imdb.com/title/tt7532578/?ref_=sr_i_422,,,
423. Django,2017,1h 57m,PG-13,6.4,2.1K,,"The story of Django Reinhardt, famous guitarist and composer, and his flight from German-occupied Paris in 1943.",https://www.imdb.com/title/tt6247936/?ref_=sr_i_423,,,
424. God of War,2017,2h 8m,Not Rated,6.4,2.5K,,A maverick commander and a young general join forces to battle pirates who pillage small villages in 16th-century China. The violent clash of wits and weapons will ultimately decide who rules the land.,https://www.imdb.com/title/tt6083388/?ref_=sr_i_424,,,
425. Digimon Adventure tri. Part 5: Coexistence,2017,1h 29m,TV-PG,6.8,1K,,Homeostasis is trying to maintain harmony but considers Meicoomon's power to be an existential threat to both worlds. While the DigiDestined return to the Real World alienated by the abnormal state of the Digital World.,https://www.imdb.com/title/tt5468018/?ref_=sr_i_425,,,
426. Extra Service,2017,1h 43m,,4.5,77,,"Three women who work as massage therapists are actually secret agents, and receive a set of three new missions.",https://www.imdb.com/title/tt6413002/?ref_=sr_i_426,,,
427. Beautiful Accident,2017,1h 44m,,6.5,344,,"Dying prematurely in a car crash, a woman first returns as a wife and mother of 2 for a week, before returning to be the single lawyer again.",https://www.imdb.com/title/tt6797204/?ref_=sr_i_427,,,
428. I Am Not a Witch,2017,1h 33m,,6.9,4.4K,,"In a remote Zambian community a girl is denounced as a witch and sent on a trajectory of exploitation, as a tethered member of a witches' camp, a witch for hire and a tourist exhibit.",https://www.imdb.com/title/tt6213284/?ref_=sr_i_428,,,
429. Porcupine Lake,2017,1h 25m,,5.5,708,,"Porcupine Lake is a story of bravery and the secret life of girls set in Northern Ontario during a hot and hazy summertime when adulthood has not yet arrived, but childhood is quickly vanishing.",https://www.imdb.com/title/tt5913968/?ref_=sr_i_429,,,
430. The China Hustle,2017,1h 22m,R,7.1,4K,,"An unsettling and eye-opening Wall Street horror story about Chinese companies, the American stock market, and the opportunistic greed behind the biggest heist you've never heard of.",https://www.imdb.com/title/tt7215388/?ref_=sr_i_430,,,
431. Person to Person,2017,1h 24m,Not Rated,5.7,1.9K,,Follows a variety of New York characters as they navigate personal relationships and unexpected problems over the course of one day.,https://www.imdb.com/title/tt5247026/?ref_=sr_i_431,,,
432. Napping Princess,2017,1h 51m,,6.3,1.6K,,"In the near future, a high school senior discovers that events in her waking life begin to parallel events in her dreams.",https://www.imdb.com/title/tt5731132/?ref_=sr_i_432,,,
433. Saving Banksy,2017,1h 20m,Unrated,6.8,1.1K,,"Internationally known graffiti artist, Banksy, left his mark on San Francisco in April 2010. Little did he know that this act of vandalism would spark a chain of events that includes one of his rats being removed from a wall, Museums ignorantly turning down a free Banksy street work, and a NY gallerist who has made it his business model to remove Banksy street works from all over the globe doing whatever it takes to get the rat in his possession.",https://www.imdb.com/title/tt4036488/?ref_=sr_i_433,,,
434. Quest,2017,1h 44m,,7.2,364,,A husband and wife live in an impoverished neighborhood in north Philadelphia while they raise their daughter and run a recording studio in their basement.,https://www.imdb.com/title/tt6149818/?ref_=sr_i_434,,,
435. Saving Brinton,2017,1h 30m,,7.5,195,,"In rural Iowa, a beloved history teacher uncovers the century-old showreels of one of America's first motion picture impresarios and sets out to premiere the films at the world's oldest continuously operating movie theatre.",https://www.imdb.com/title/tt6195442/?ref_=sr_i_435,,,
436. Racer and the Jailbird,2017,2h 10m,R,6.3,5.8K,,"Set against the background of a brutal crime gang in Brussels, a tragic love story between Gigi, a high-flying gangster, and Bibi, a young racing driver with very upper-class roots.",https://www.imdb.com/title/tt2586120/?ref_=sr_i_436,,,
437. Summer in the Forest,2017,1h 48m,,7.8,44,,"Like countless others, Philippe, Michel, Andre and Patrick were labeled 'idiots', locked away and forgotten in violent asylums, until the 1960s, when the young philosopher Jean Vanier took a stand and secured their release - the first time in history that anyone had beaten the system. Together they created L'Arche, a commune at the edge of a beautiful forest near Paris. A quiet revolution was born. Now in his 80s, still at L'Arche and revered by some as a living saint, Jean has discovered something that most of us have forgotten - what it is to be human, to be foolish, and to be happy. SUMMER IN THE FOREST invite us to abandon the rat race and forge new friendships. Amid the ancient trees, Philippe, Patrick, Jean and the others welcome us into their lives. If there are rules to break, they will be broken. And if there is a truth to be told, they will tell it. Michel reveals his war-torn past, Andre is desperate for a date, and young David will prove himself a hero in the fight against the forces of evil.",https://www.imdb.com/title/tt5900988/?ref_=sr_i_437,,,
438. Before We Vanish,2017,2h 9m,R,6.2,2.9K,,"Three aliens travel to Earth in preparation for a mass invasion, taking possession of human bodies.",https://www.imdb.com/title/tt5999530/?ref_=sr_i_438,,,
439. Who Can you Trust II: Diamond's Revenge,2017,1h 29m,,,,,Who Can U trust is about a guy named gudda that moved to Nc... from Baltimore after his cousin was killed because of him...Now his cousins fiancee wants him dead because she lost her soon to be husband and her unborn child,https://www.imdb.com/title/tt7133598/?ref_=sr_i_439,,,
440. Rodin,2017,1h 59m,Not Rated,5.0,1.5K,,An account of the famous French sculptor's romance with Camille Claudel.,https://www.imdb.com/title/tt5771710/?ref_=sr_i_440,,,
441. What Will People Say,2017,1h 46m,,7.4,6.1K,,"The story of Nisha, daughter of a Pakistani-Norwegian family, who is kidnapped to Pakistan by her parents when her father finds her in bed with a man.",https://www.imdb.com/title/tt7213936/?ref_=sr_i_441,,,
442. Hitler's Hollywood,2017,1h 45m,Not Rated,6.8,867,,"Rüdiger Suchsland examines German cinema from 1933, when the Nazis came into power, until 1945 when the Third Reich collapsed.",https://www.imdb.com/title/tt6566624/?ref_=sr_i_442,,,
443. Antonio Lopez 1970: Sex Fashion & Disco,2017,1h 35m,,6.9,219,,"Sex Fashion and Disco is a documentary film concerning Antonio Lopez (1943-1987), the most influential fashion illustrator of 1970s Paris and New York, and his colorful and sometimes outrageous milieu.",https://www.imdb.com/title/tt5792490/?ref_=sr_i_443,,,
444. Battlecreek,2017,1h 37m,R,5.7,1.1K,,"Henry is a loner and a night owl. His rare skin disease has kept him under the close watch of his fiery mother, who has sheltered him his entire life. One night, a young woman's car breaks down and Henry's life will change forever.",https://www.imdb.com/title/tt1880415/?ref_=sr_i_444,,,
445. Woodshock,2017,1h 40m,R,4.2,2.4K,,"A woman, consumed by profound grief after a personal loss, aided by a potent drug meant for the terminally ill, delves into her psyche for solace set in the hauntingly beautiful redwood forests.",https://www.imdb.com/title/tt4677924/?ref_=sr_i_445,,,
446. Western,2017,2h 1m,Unrated,7.0,4.4K,,"German construction workers building a dam near a Bulgarian village interact with the locals, and soon the troubles arise both with the locals and among themselves.",https://www.imdb.com/title/tt5157326/?ref_=sr_i_446,,,
447. Maurice!,2017,,,,,,The Spiritual Remake to Clifford (1994) 10 Year Old Maurice Mandel is sent to his Uncle while his parents are on a Vacation Maurice tries to Ruin his Uncles life for not getting his Way,https://www.imdb.com/title/tt6513708/?ref_=sr_i_447,,,
448. Liyana,2017,1h 17m,,7.4,401,,Five children in Swaziland dive into their imaginations to create an original African tale about a girl on a dangerous quest.,https://www.imdb.com/title/tt6977442/?ref_=sr_i_448,,,
449. Humor Me,2017,1h 33m,,6.1,1.5K,,"With an interminable case of writer's block and a personal family crisis, playwright Nate is forced to move into his father's retirement community.",https://www.imdb.com/title/tt5658242/?ref_=sr_i_449,,,
450. Unrest,2017,1h 38m,,7.5,3.2K,,"When Harvard Ph.D. student Jennifer Brea is struck down by a fever that leaves her bedridden, she sets out on a virtual journey to document her story as she fights a disease that medicine forgot.",https://www.imdb.com/title/tt3268850/?ref_=sr_i_450,,,
451. Submission,2017,1h 46m,R,5.7,1.6K,,A cynical college professor takes a keen interest in a talented young writing student.,https://www.imdb.com/title/tt2707810/?ref_=sr_i_451,,,
452. Just One Drop,2017,1h 6m,,6.5,17,,A film about the most controversial form of medicine ever invented. Homeopathy,https://www.imdb.com/title/tt6874242/?ref_=sr_i_452,,,
453. Zilla and Zoe,2017,1h 44m,Not Rated,4.8,166,,"To win the contest of her dreams, Zoe will have to turn her sister's wedding into a horror film.",https://www.imdb.com/title/tt4817466/?ref_=sr_i_453,,,
454. Araby,2017,1h 37m,,7.3,1.4K,,"Andre is a young boy that lives in an industrial neighborhood in Ouro Preto, Brazil, near an old aluminum factory. One day he finds a notebook from one of the factory workers.",https://www.imdb.com/title/tt6400280/?ref_=sr_i_454,,,
455. Golden Exits,2017,1h 34m,R,5.7,2.4K,,An intersectional narrative of two families in Brooklyn and the unraveling of unspoken unhappiness that occurs when a young foreign girl spending time abroad upsets the balance on both sides.,https://www.imdb.com/title/tt5687814/?ref_=sr_i_455,,,
456. 78/52,2017,1h 31m,Not Rated,7.3,3.9K,,"An unprecedented look at the iconic shower scene in Alfred Hitchcock's Psycho (1960), the ""man behind the curtain"", and the screen murder that profoundly changed the course of world cinema.",https://www.imdb.com/title/tt4372240/?ref_=sr_i_456,,,
457. Krystal,2017,1h 30m,R,5.5,1.8K,,A young man living a sheltered life develops a crush on an ex-stripper and joins her Alcoholics Anonymous group just so he can be in the same room with her.,https://www.imdb.com/title/tt0835802/?ref_=sr_i_457,,,
458. On the Beach at Night Alone,2017,1h 41m,,6.8,5K,,"An actress wanders around a seaside town, pondering her relationship with a married man.",https://www.imdb.com/title/tt6412864/?ref_=sr_i_458,,,
459. Breath,2017,1h 55m,TV-MA,6.7,4K,,"After developing an interest in surfing, a teenage boy and his friend forge an unlikely friendship with an older surfer.",https://www.imdb.com/title/tt1553659/?ref_=sr_i_459,,,
"460. No Date, No Signature",2017,1h 39m,,7.2,7K,,"When Dr. Kaveh Nariman, a forensic pathologist, comes to work he encounters a corpse that looks familiar.",https://www.imdb.com/title/tt6207878/?ref_=sr_i_460,,,
461. The Sower,2017,1h 38m,,6.5,764,,"Violette is old enough to get married when her village in the Lower Alps is cruelly deprived of all its men by the repression that followed the republican uprising of December 1851. For the next two years, the village is completely cut off. The women swear an oath that if a man should come, he will become their shared husband, so that life may continue to flourish in each of their wombs.",https://www.imdb.com/title/tt7124090/?ref_=sr_i_461,,,
462. The House of Tomorrow,2017,1h 25m,Not Rated,6.2,2.5K,,"The film tells futurist, architect, and inventor R. Buckminster Fuller's incredible story through two teens hoping to get laid, become punk gods, and survive high school.",https://www.imdb.com/title/tt5910344/?ref_=sr_i_462,,,
463. The Big Bad Fox and Other Tales,2017,1h 23m,G,7.4,3.8K,,"Whoever thinks that the countryside is calm and peaceful is mistaken. In it we find especially agitated animals, a Fox that thinks it's a chicken, a Rabbit that acts like a stork, and a Duck who wants to replace Father Christmas. If you want to take a vacation, keep driving past this place.",https://www.imdb.com/title/tt5851904/?ref_=sr_i_463,,,
