Title,Year,Duration,MPA,Rating,Votes,méta_score,description,Movie Link,writers,director,budget
97. The Disaster Artist,2017,1h 44m,R,7.3,167K,,"When aspiring actor Greg Sestero meets the weird and mysterious Tommy Wiseau in an acting class, they form a unique friendship and travel to Hollywood to make their dreams come true.",https://www.imdb.com/title/tt3521126/?ref_=sr_i_97,,,
98. Phantom Thread,2017,2h 10m,R,7.4,149K,,"Set in 1950s London, Reynolds Woodcock is a renowned dressmaker whose fastidious life is disrupted by a young, strong-willed woman, Alma, who becomes his muse and lover.",https://www.imdb.com/title/tt5776858/?ref_=sr_i_98,,,
99. Sleepless,2017,1h 35m,R,5.6,35K,,A cop with a connection to the criminal underworld scours a nightclub in search of his kidnapped son.,https://www.imdb.com/title/tt2072233/?ref_=sr_i_99,,,
100. Diary of a Wimpy Kid: The Long Haul,2017,1h 31m,PG,4.3,11K,,A Heffley family road trip to attend Meemaw's 90th birthday party goes hilariously off course thanks to Greg's newest scheme to get to a video gaming convention.,https://www.imdb.com/title/tt6003368/?ref_=sr_i_100,,,
101. The Circle,2017,1h 50m,PG-13,5.4,102K,,"A woman lands a dream job at a powerful tech company called the Circle, only to uncover an agenda that will affect the lives of all of humanity.",https://www.imdb.com/title/tt4287320/?ref_=sr_i_101,,,
102. Baahubali 2: The Conclusion,2017,2h 47m,Not Rated,8.2,120K,,"Amarendra Baahubali, the heir apparent to the throne of Mahishmati, finds his life and relationships endangered as his adoptive brother Bhallaladeva conspires to claim the throne.",https://www.imdb.com/title/tt4849438/?ref_=sr_i_102,,,
103. CHIPS,2017,1h 40m,R,6.0,52K,,An inexperienced rookie is teamed up with a hardened pro at the California Highway Patrol in Los Angeles; the newbie officer soon learns his partner is really an undercover Fed investigating a heist which may involve some crooked cops.,https://www.imdb.com/title/tt0493405/?ref_=sr_i_103,,,
104. Only the Brave,2017,2h 14m,PG-13,7.6,80K,,"Based on the true story of the Granite Mountain Hotshots, a group of elite firefighters who risk everything to protect a town from a historic wildfire.",https://www.imdb.com/title/tt3829920/?ref_=sr_i_104,,,
105. Call Me by Your Name,2017,2h 12m,R,7.8,330K,,"It's the summer of 1983, and 17-year-old Elio is spending the days with his family at their villa in Lombardy, Italy. He soon meets Oliver, who's working as an intern for Elio's father. They discover the heady beauty of awakening desire.",https://www.imdb.com/title/tt5726616/?ref_=sr_i_105,,,
106. Mother!,2017,2h 1m,R,6.6,256K,,"A couple's relationship is tested when uninvited guests arrive at their home, disrupting their tranquil existence.",https://www.imdb.com/title/tt5109784/?ref_=sr_i_106,,,
107. Father Figures,2017,1h 53m,R,5.5,22K,,"Upon learning that their mother has been lying to them for years about their allegedly deceased father, fraternal twin brothers hit the road to search for him.",https://www.imdb.com/title/tt1966359/?ref_=sr_i_107,,,
108. The Zookeeper's Wife,2017,2h 7m,PG-13,7.0,48K,,"Keepers of the Warsaw Zoo, Antonina and Jan Zabinski, must save hundreds of people and animals during the Nazi invasion in WWII Poland.",https://www.imdb.com/title/tt1730768/?ref_=sr_i_108,,,
109. Chappaquiddick,2017,1h 46m,PG-13,6.4,15K,,"Depicting Ted Kennedy's involvement in the fatal 1969 car accident that claims the life of a young campaign strategist, Mary Jo Kopechne.",https://www.imdb.com/title/tt5270948/?ref_=sr_i_109,,,
110. The Glass Castle,2017,2h 7m,PG-13,7.1,39K,,A young girl comes of age in a dysfunctional family of nonconformist nomads with a mother who's an eccentric artist and an alcoholic father who would stir the children's imagination with hope as a distraction to their poverty.,https://www.imdb.com/title/tt2378507/?ref_=sr_i_110,,,
111. Flatliners,2017,1h 49m,PG-13,5.2,52K,,"Five medical students, obsessed by what lies beyond the confines of life, embark on a daring experiment: by stopping their hearts for short periods, each triggers a near-death experience - giving them a firsthand account of the afterlife.",https://www.imdb.com/title/tt2039338/?ref_=sr_i_111,,,
112. Detroit,2017,2h 23m,R,7.3,57K,,Fact-based drama set during the 1967 Detroit riots in which a group of rogue police officers respond to a complaint with retribution rather than justice on their minds.,https://www.imdb.com/title/tt5390504/?ref_=sr_i_112,,,
113. The Case for Christ,2017,1h 52m,PG,6.3,11K,,An investigative journalist and self-proclaimed atheist sets out to disprove the existence of God after his wife becomes a Christian.,https://www.imdb.com/title/tt6113488/?ref_=sr_i_113,,,
114. Wish Upon,2017,1h 30m,PG-13,5.1,24K,,A teenage girl discovers a box that carries magic powers and a deadly price for using them.,https://www.imdb.com/title/tt5322012/?ref_=sr_i_114,,,
115. Borg vs. McEnroe,2017,1h 47m,R,6.9,35K,,The story of the 1980 tennis rivalry between the placid Björn Borg and the volatile John McEnroe.,https://www.imdb.com/title/tt5727282/?ref_=sr_i_115,,,
116. It Comes at Night,2017,1h 31m,R,6.1,106K,,"Secure within a desolate home as an unnatural threat terrorizes the world, a man has established a tenuous domestic order with his wife and son. Then a desperate young family arrives seeking refuge.",https://www.imdb.com/title/tt4695012/?ref_=sr_i_116,,,
117. Megan Leavey,2017,1h 56m,PG-13,7.1,29K,,Based on the true life story of a young Marine corporal whose unique discipline and bond with her military combat dog saved many lives during their deployment in Iraq.,https://www.imdb.com/title/tt4899370/?ref_=sr_i_117,,,
118. Battle of the Sexes,2017,2h 1m,PG-13,6.7,61K,,The true story of the 1973 tennis match between World number one Billie Jean King and ex-champ and serial hustler Bobby Riggs.,https://www.imdb.com/title/tt4622512/?ref_=sr_i_118,,,
119. Before I Fall,2017,1h 38m,PG-13,6.4,58K,,"February 12 is just another day in Sam's charmed life, until it turns out to be her last. Stuck reliving her last day over and over, Sam untangles the mystery around her death and discovers everything she's losing.",https://www.imdb.com/title/tt1691916/?ref_=sr_i_119,,,
"120. Roman J. Israel, Esq.",2017,2h 2m,PG-13,6.5,45K,,"Roman J. Israel, Esq., a driven, idealistic defense attorney, finds himself in a tumultuous series of events that lead to a crisis and the necessity for extreme action.",https://www.imdb.com/title/tt6000478/?ref_=sr_i_120,,,
121. Unforgettable,2017,1h 40m,R,5.1,17K,,A woman sets out to make life a living hell for her ex-husband's new fiancée.,https://www.imdb.com/title/tt3462710/?ref_=sr_i_121,,,
122. The Beguiled,2017,1h 33m,R,6.3,64K,,The unexpected arrival of a wounded Union soldier at a girls school in Virginia during the American Civil War leads to jealousy and betrayal.,https://www.imdb.com/title/tt5592248/?ref_=sr_i_122,,,
123. Marshall,2017,1h 58m,PG-13,7.3,27K,,"The story of Thurgood Marshall, the crusading lawyer who would become the first African-American Supreme Court Justice, as he battles through one of his career-defining cases.",https://www.imdb.com/title/tt5301662/?ref_=sr_i_123,,,
124. The Wife,2017,1h 39m,R,7.2,44K,,A wife questions her life choices as she travels to Stockholm to see her husband receive the Nobel Prize for Literature.,https://www.imdb.com/title/tt3750872/?ref_=sr_i_124,,,
125. Thank You for Your Service,2017,1h 49m,R,6.6,16K,,"A group of U.S. soldiers returning from Iraq struggle to integrate back into family and civilian life, while living with the memory of a war that threatens to destroy them long after they've left the battlefield.",https://www.imdb.com/title/tt2776878/?ref_=sr_i_125,,,
126. The Death of Stalin,2017,1h 47m,R,7.3,117K,,"Moscow, 1953. After being in power for nearly 30 years, Soviet dictator, Joseph Vissarionovich Stalin, takes ill and quickly dies. Now the members of the Council of Ministers scramble for power.",https://www.imdb.com/title/tt4686844/?ref_=sr_i_126,,,
127. The Space Between Us,2017,2h,PG-13,6.4,57K,,"The first human born on Mars travels to Earth for the first time, experiencing the wonders of the planet through fresh eyes. He embarks on an adventure with a street-smart girl to discover how he came to be.",https://www.imdb.com/title/tt3922818/?ref_=sr_i_127,,,
128. Let There Be Light,2017,1h 40m,PG-13,4.6,3.3K,,An atheist goes through a near-death experience in a car accident before converting to Christianity.,https://www.imdb.com/title/tt5804314/?ref_=sr_i_128,,,
129. Beatriz at Dinner,2017,1h 22m,R,6.0,11K,,A holistic medicine practitioner attends a wealthy client's dinner party after her car breaks down.,https://www.imdb.com/title/tt5929750/?ref_=sr_i_129,,,
130. Loving Vincent,2017,1h 34m,PG-13,7.8,65K,,"In a story depicted in oil painted animation, a young man comes to the last hometown of painter Vincent van Gogh to deliver the troubled artist's final letter and ends up investigating his final days there.",https://www.imdb.com/title/tt3262342/?ref_=sr_i_130,,,
131. The Snowman,2017,1h 59m,R,5.2,74K,,Detective Harry Hole investigates the disappearance of a woman whose scarf is found wrapped around an ominous-looking snowman.,https://www.imdb.com/title/tt1758810/?ref_=sr_i_131,,,
132. Same Kind of Different as Me,2017,1h 59m,PG-13,6.6,8.7K,,"International art dealer Ron Hall must befriend a dangerous homeless man in order to save his struggling marriage to his wife, a woman whose dreams will lead all three of them on the journey of their lives.",https://www.imdb.com/title/tt1230168/?ref_=sr_i_132,,,
133. Just Getting Started,2017,1h 31m,PG-13,4.6,8.6K,,An ex-F.B.I. Agent (Tommy Lee Jones) and an ex-mob lawyer in the Witness Protection Program (Morgan Freeman) have to put aside their petty rivalry on the golf course to fend off a mob hit.,https://www.imdb.com/title/tt5721088/?ref_=sr_i_133,,,
134. Ezra,2017,2h 27m,,6.6,3.2K,,"A newly married woman brings an antique Jewish box into her home, unaware that the box contains the ghost of Abraham Ezra.",https://www.imdb.com/title/tt5892746/?ref_=sr_i_134,,,
135. Fantastic Journey to Oz,2017,1h 31m,,4.7,378,,"Young Dorothy leaves for the land of Oz with a group of friends. Upon arrival, the travelers realize that Emerald City has been renamed Urfinville by the cunning and wicked Urfin.",https://www.imdb.com/title/tt4685636/?ref_=sr_i_135,,,
136. The Florida Project,2017,1h 51m,R,7.6,134K,,"Set over one summer, the film follows precocious six-year-old Moonee as she courts mischief and adventure with her ragtag playmates and bonds with her rebellious but caring mother, all while living in the shadows of Walt Disney World.",https://www.imdb.com/title/tt5649144/?ref_=sr_i_136,,,
137. All Saints,2017,1h 48m,PG,6.3,2.1K,,"When a group of Burmese refugees join the congregation, the pastor of a failing Anglican church attempts to aid them by planting crops and enlisting the help of the community.",https://www.imdb.com/title/tt4663548/?ref_=sr_i_137,,,
138. Suburbicon,2017,1h 45m,R,5.8,48K,,"As a 1950s suburban community self-destructs, a home invasion has sinister consequences for one seemingly normal family.",https://www.imdb.com/title/tt0491175/?ref_=sr_i_138,,,
139. The Man Who Invented Christmas,2017,1h 44m,PG,7.0,20K,,"The journey that led to Charles Dickens' creation of ""A Christmas Carol,"" a timeless tale that would redefine Christmas.",https://www.imdb.com/title/tt6225520/?ref_=sr_i_139,,,
140. Bitter Harvest,2017,1h 43m,R,5.9,4.2K,,"Set in 1930s Ukraine, as Stalin advances the ambitions of communists in the Kremlin, young artist Yuri battles to save his lover Natalka from the Holodomor, the death-by-starvation program that ultimately killed millions of Ukrainians.",https://www.imdb.com/title/tt3182620/?ref_=sr_i_140,,,
141. Tiger Zinda Hai,2017,2h 41m,Not Rated,5.9,35K,,RAW Agent Tiger joins forces with Zoya in order to rescue a group of nurses who are held hostage by a terrorist organisation.,https://www.imdb.com/title/tt5956100/?ref_=sr_i_141,,,
142. The Book of Henry,2017,1h 45m,PG-13,6.6,30K,,"With instructions from her genius son's carefully crafted notebook, a single mother sets out to rescue a young girl from the hands of her abusive stepfather.",https://www.imdb.com/title/tt4572792/?ref_=sr_i_142,,,
143. Stronger,2017,1h 59m,R,6.9,51K,,"Stronger is the inspiring real life story of Jeff Bauman, an ordinary man who captured the hearts of his city and the world to become a symbol of hope after surviving the 2013 Boston Marathon bombing.",https://www.imdb.com/title/tt3881784/?ref_=sr_i_143,,,
144. The Hero,2017,1h 36m,R,6.5,11K,,An ailing movie star comes to terms with his past and mortality.,https://www.imdb.com/title/tt5655222/?ref_=sr_i_144,,,
145. Table 19,2017,1h 27m,PG-13,5.8,32K,,"Eloise, having been relieved of maid of honor duties after being unceremoniously dumped by the best man via text, decides to attend the wedding anyway, only to find herself seated with five fellow unwanted guests at the dreaded Table 19.",https://www.imdb.com/title/tt1412528/?ref_=sr_i_145,,,
146. Phoenix Forgotten,2017,1h 27m,PG-13,5.4,7.2K,,"Two decades after three teenagers disappeared in the wake of mysterious lights appearing above Phoenix, Arizona, unseen footage from that night has been discovered, chronicling the final hours of their fateful expedition.",https://www.imdb.com/title/tt6574272/?ref_=sr_i_146,,,
147. An Inconvenient Sequel: Truth to Power,2017,1h 38m,PG,6.6,8.4K,,"A decade after An Inconvenient Truth (2006) brought climate change to the heart of popular culture, the follow-up shows just how close we are to a real energy revolution.",https://www.imdb.com/title/tt6322922/?ref_=sr_i_147,,,
148. Disobedience,2017,1h 54m,R,6.6,38K,,"A woman returns to her Orthodox Jewish community that shunned her for her attraction to a female childhood friend. Once back, their passions reignite as they explore the boundaries of faith and sexuality.",https://www.imdb.com/title/tt6108178/?ref_=sr_i_148,,,
149. Til Death Do Us Part,2017,1h 41m,PG-13,4.7,1.6K,,"Michael and Madison had planned to spend the rest of their lives together, until one day Michael's controlling ways turned their perfect marriage. Madison meets Alex Stone and learns to love again, until Michael re-appears in her life.",https://www.imdb.com/title/tt6848602/?ref_=sr_i_149,,,
150. First Reformed,2017,1h 53m,R,7.1,64K,,"A minister of a small congregation in upstate New York grapples with mounting despair brought on by tragedy, worldly concerns and a tormented past.",https://www.imdb.com/title/tt6053438/?ref_=sr_i_150,,,
151. Raees,2017,2h 23m,TV-MA,6.6,52K,,A bootlegger sets out to improve his community as a promising leader but falls in a political trap.,https://www.imdb.com/title/tt3405236/?ref_=sr_i_151,,,
152. The Leisure Seeker,2017,1h 52m,R,6.7,10K,,"A runaway couple go on an unforgettable journey in the faithful old RV they call ""The Leisure Seeker"".",https://www.imdb.com/title/tt3741632/?ref_=sr_i_152,,,
153. Ingrid Goes West,2017,1h 38m,R,6.6,49K,,"After her release from a psychiatric ward, a woman obsessed with social media moves to LA to stalk an Instagram star, but her plan takes a dark turn.",https://www.imdb.com/title/tt5962210/?ref_=sr_i_153,,,
154. Thoroughbreds,2017,1h 32m,R,6.6,47K,,"Two upper-class teenage girls in suburban Connecticut rekindle their unlikely friendship after years of growing apart. Together, they hatch a plan to solve both of their problems-no matter what the cost.",https://www.imdb.com/title/tt5649108/?ref_=sr_i_154,,,
155. Disney's Newsies: The Broadway Musical!,2017,2h 29m,PG,8.3,3.8K,,"Filmed live on stage at the Pantages Theatre in Hollywood, CA, this is a not-to-be-missed high energy show starring Original Broadway cast members.",https://www.imdb.com/title/tt6346162/?ref_=sr_i_155,,,
156. Wolf Warrior 2,2017,2h 3m,Not Rated,5.9,9.1K,,"China's deadliest special forces operative settles into a quiet life on the sea. When sadistic mercenaries begin targeting nearby civilians, he must leave his newfound peace behind and return to his duties as a soldier and protector.",https://www.imdb.com/title/tt7131870/?ref_=sr_i_156,,,
157. Is Genesis History?,2017,1h 40m,Not Rated,4.1,1.8K,,"Explore the world to see how it intersects with the stories related in Genesis. Del Tackett of ""The Truth Project"" hikes through canyons, climbs mountains, and dives below the sea to examine two competing views - one compelling truth.",https://www.imdb.com/title/tt6360332/?ref_=sr_i_157,,,
158. My Cousin Rachel,2017,1h 46m,PG-13,6.0,21K,,"A young Englishman plots revenge against his late cousin's mysterious, beautiful wife, believing her responsible for his death. But his feelings become complicated as he finds himself falling under the beguiling spell of her charms.",https://www.imdb.com/title/tt4411596/?ref_=sr_i_158,,,
159. A Question of Faith,2017,1h 44m,PG,6.0,1.2K,,"When tragedy strikes three families, their destiny forces them on a converging path to discover God's love, grace, and mercy as the challenges of their fate could also resurrect their beliefs.",https://www.imdb.com/title/tt6054650/?ref_=sr_i_159,,,
160. Do It Like An Hombre,2017,1h 49m,R,5.6,1.4K,,"Raúl, Eduardo, and Santiago have led a happy, ""straight"" life since their childhood, until one day, Santiago tells the others that he is gay.",https://www.imdb.com/title/tt6046212/?ref_=sr_i_160,,,
161. You Were Never Really Here,2017,1h 29m,R,6.7,130K,,"A traumatized veteran unafraid of violence tracks down missing girls for a living. When a job spins out of control, Joe's nightmares overtake him as a conspiracy is uncovered leading to what could be his death trip or his awakening.",https://www.imdb.com/title/tt5742374/?ref_=sr_i_161,,,
162. Tulip Fever,2017,1h 45m,R,6.2,23K,,An artist falls for a young married woman while he's commissioned to paint her portrait during the Tulip mania of seventeenth century Amsterdam.,https://www.imdb.com/title/tt0491203/?ref_=sr_i_162,,,
163. The Rider,2017,1h 44m,R,7.4,21K,,"After suffering a near-fatal head injury, a young cowboy undertakes a search for new identity and what it means to be a man in the heartland of America.",https://www.imdb.com/title/tt6217608/?ref_=sr_i_163,,,
164. Mary and the Witch's Flower,2017,1h 43m,PG,6.8,18K,,"Based on ""The Little Broomstick"" by Mary Stewart, a strange flower grants a girl magic powers.",https://www.imdb.com/title/tt6336356/?ref_=sr_i_164,,,
165. T2 Trainspotting,2017,1h 57m,R,7.1,135K,,"After 20 years abroad, Mark Renton returns to Scotland and reunites with his old friends Sick Boy, Spud, and Begbie.",https://www.imdb.com/title/tt2763304/?ref_=sr_i_165,,,
166. Pokémon the Movie: I Choose You!,2017,1h 38m,PG,6.3,7.7K,,Ash Ketchum from Pallet Town is 10 years old today. This means he is now old enough to become a Pokémon Trainer. Ash dreams big about the adventures he will experience after receiving his first Pokémon from Professor Oak.,https://www.imdb.com/title/tt6595896/?ref_=sr_i_166,,,
167. Papillon,2017,2h 13m,R,7.2,89K,,"Wrongfully convicted for murder, Henri Charriere forms an unlikely relationship with fellow inmate and quirky convicted counterfeiter, Louis Dega, in an attempt to escape from the notorious penal colony on Devil's Island.",https://www.imdb.com/title/tt5093026/?ref_=sr_i_167,,,
168. The Killing of a Sacred Deer,2017,2h 1m,R,7.0,198K,,"Steven, a charismatic surgeon, is forced to make an unthinkable sacrifice after his life starts to fall apart, when the behavior of a teenage boy he has taken under his wing turns sinister.",https://www.imdb.com/title/tt5715874/?ref_=sr_i_168,,,
169. The Resurrection of Gavin Stone,2017,1h 31m,PG,6.3,2.6K,,"A washed-up former child star, forced to do community service at a local megachurch, pretends to be a Christian to land the part of Jesus in their annual Passion Play, only to discover that the most important role of his life is far from Hollywood.",https://www.imdb.com/title/tt4902904/?ref_=sr_i_169,,,
170. Jeepers Creepers III,2017,1h 40m,Not Rated,3.9,25K,,Sheriff Dan Tashtego and a team of creeper hunters enlist the help of officer Davis Tubbs to help stop the monster's eating spree.,https://www.imdb.com/title/tt1139592/?ref_=sr_i_170,,,
171. The Lovers,2017,1h 37m,R,6.1,4.3K,,"Debra Winger and Tracy Letts play a long-married, dispassionate couple who are both in the midst of serious affairs. But on the brink of calling it quits, a spark between them suddenly reignites, leading them into an impulsive romance.",https://www.imdb.com/title/tt5770620/?ref_=sr_i_171,,,
172. Brad's Status,2017,1h 42m,R,6.5,19K,,A father takes his son to tour colleges on the East Coast and meets up with an old friend who makes him feel inferior about his life's choices.,https://www.imdb.com/title/tt5884230/?ref_=sr_i_172,,,
173. Good Time,2017,1h 42m,R,7.3,144K,,"After a botched bank robbery lands his younger brother in prison, Connie Nikas embarks on a twisted odyssey through New York City's underworld to get his brother Nick out of jail.",https://www.imdb.com/title/tt4846232/?ref_=sr_i_173,,,
174. A Fantastic Woman,2017,1h 44m,R,7.2,28K,,"Marina, a transgender woman who works as a waitress and moonlights as a nightclub singer, is bowled over by the death of her older boyfriend.",https://www.imdb.com/title/tt5639354/?ref_=sr_i_174,,,
175. The Bride of Badrinath,2017,2h 19m,Not Rated,6.1,14K,,Badrinath is looking for a typical bride; Vaidehi is looking for an independent life. Together they must break with tradition and redefine their role.,https://www.imdb.com/title/tt6277440/?ref_=sr_i_175,,,
176. Indian Horse,2017,1h 41m,Not Rated,7.3,2.7K,,"Follows the life of Native Canadian Saul Indian Horse as he survives residential school and life amongst the racism of the 1970s. A talented hockey player, Saul must find his own path as he battles stereotypes and alcoholism.",https://www.imdb.com/title/tt5672286/?ref_=sr_i_176,,,
177. Everybody Loves Somebody,2017,1h 42m,PG-13,6.4,4.4K,,"A single, successful career woman asks her co-worker to pose as her boyfriend at a family wedding back home in Mexico. Her situation gets complicated when her ex shows up at the ceremony.",https://www.imdb.com/title/tt5537228/?ref_=sr_i_177,,,
178. Along With the Gods: The Two Worlds,2017,2h 19m,Not Rated,7.2,20K,,"After a heroic death, a firefighter navigates the afterlife with the help of three guides.",https://www.imdb.com/title/tt7160070/?ref_=sr_i_178,,,
179. Youth,2017,2h 15m,Not Rated,7.0,3.6K,,A look at the lives of members of a Military Cultural Troupe in the 1970s.,https://www.imdb.com/title/tt6654316/?ref_=sr_i_179,,,
180. Toilet: A Love Story,2017,2h 35m,Not Rated,7.2,24K,,"A woman threatens to leave her husband unless he installs a toilet in their home. To win back her love and respect, he heads out on a journey to fight against the backward society.",https://www.imdb.com/title/tt5785170/?ref_=sr_i_180,,,
181. The Wall,2017,1h 28m,R,6.2,32K,,Two American soldiers are pinned down in the Iraqi desert by a lethal sniper with only a crumbling wall between them.,https://www.imdb.com/title/tt4218696/?ref_=sr_i_181,,,
182. The Last Word,2017,1h 48m,R,6.6,9.1K,,"Harriet is a retired businesswoman who tries to control everything around her. When she decides to write her own obituary, a young journalist takes up the task of finding out the truth, resulting in a life-altering friendship.",https://www.imdb.com/title/tt5023260/?ref_=sr_i_182,,,
183. Goodbye Christopher Robin,2017,1h 47m,PG,7.1,30K,,"The relationship between writer AA Milne and his son, Christopher Robin, and how this became the inspiration for Winnie the Pooh.",https://www.imdb.com/title/tt1653665/?ref_=sr_i_183,,,
184. Jane,2017,1h 30m,PG,7.8,5.8K,,"The life and work of the renowned primatology scientist, Jane Goodall, especially on her research about chimpanzees.",https://www.imdb.com/title/tt7207238/?ref_=sr_i_184,,,
185. Menashe,2017,1h 22m,PG,6.6,2.6K,,"Within Brooklyn's ultra-orthodox Jewish community, a widower battles for custody of his son. A tender drama performed entirely in Yiddish, the film intimately explores the nature of faith and the price of parenthood.",https://www.imdb.com/title/tt6333086/?ref_=sr_i_185,,,
186. Slamma Jamma,2017,1h 44m,PG,5.9,1.7K,,"Wrongfully accused and sent to prison, a former basketball star prepares for the national slam dunk competition while finding redemption in Christ and in those he loves.",https://www.imdb.com/title/tt5319866/?ref_=sr_i_186,,,
187. The Little Hours,2017,1h 29m,R,5.8,26K,,"In the Middle Ages, a young servant fleeing from his master takes refuge at a convent full of emotionally unstable nuns. Introduced as a deaf mute man, he must fight to hold his cover as the nuns try to resist temptation.",https://www.imdb.com/title/tt5666304/?ref_=sr_i_187,,,
188. Jolly LLB 2,2017,2h 17m,Not Rated,7.2,28K,,Jolly is a clumsy lawyer who is faced with representing the most critical court case of his career.,https://www.imdb.com/title/tt5982852/?ref_=sr_i_188,,,
189. A Ghost Story,2017,1h 32m,R,6.8,83K,,"In this singular exploration of legacy, love, loss, and the enormity of existence, a recently deceased, white-sheeted ghost returns to his suburban home to try to reconnect with his bereft wife.",https://www.imdb.com/title/tt6265828/?ref_=sr_i_189,,,
190. Professor Marston & the Wonder Women,2017,1h 48m,R,7.0,29K,,"The story of psychologist William Moulton Marston, and his polyamorous relationship with his wife and their mistress who would inspire his creation of the superheroine, Wonder Woman.",https://www.imdb.com/title/tt6133130/?ref_=sr_i_190,,,
191. The Stray,2017,1h 32m,PG,5.4,1.2K,,"A young father takes his nine-year-old son, the family dog, and two of his son's friends backpacking in the mountains of Colorado only for all five of them to be struck by lightning.",https://www.imdb.com/title/tt5342904/?ref_=sr_i_191,,,
